id:INTEGER,ISBN_13,Title,Author,Price:FLOAT,Publisher,Publication_date,Pages:INTEGER
1,9780307588371,Gone Girl: A Novel,Gillian Flynn,8.97,Broadway Books,04/22/2014,432
2,9780385537148,Gray Mountain: A Novel,John Grisham,17.37,Doubleday,10/21/2014,384
3,9781476789873,Rush Revere and the American Revolution: Time-Travel Adventures With Exceptional Americans,Rush Limbaugh,11.99,Threshold Editions,10/28/2014,256
4,9780553805444,The World of Ice & Fire: The Untold History of Westeros and the Game of Thrones (A Song of Ice and Fire),George R.R. Martin,29.98,Bantam,10/28/2014,336
5,9780544272996,What If?: Serious Scientific Answers to Absurd Hypothetical Questions,Randall Munroe,14.4,Houghton Mifflin Harcourt,09/02/2014,320
6,9780525953098,Edge of Eternity: Book Three of The Century Trilogy,Ken Follett,20.72,Dutton Adult,09/16/2014,1120
7,9780345544926,Leaving Time: A Novel,Jodi Picoult,16.8,Ballantine Books,10/14/2014,416
8,9780062268341,Yes Please,Amy Poehler,17.85,Dey Street Books,10/28/2014,352
9,9781476746586,All the Light We Cannot See: A Novel,Anthony Doerr,16.2,Scribner,05/06/2014,544
10,9780061122415,The Alchemist,Paulo Coelho,8.98,HarperOne,04/25/2006,197
11,9781476770383,Revival: A Novel,Stephen King,18,Scribner,11/11/2014,416
12,9780374187613,Lila: A Novel,Marilynne Robinson,15.6,"Farrar, Straus and Giroux",10/07/2014,272
13,9780425259870,Blood Magick (Cousins O'Dwyer),Nora Roberts,10.11,Berkley Trade,10/28/2014,336
14,9780756410438,The Slow Regard of Silent Things,Patrick Rothfuss,11.37,DAW Hardcover,10/28/2014,176
15,9780399167447,Somewhere Safe with Somebody Good: The New Mitford Novel (A Mitford Novel),Jan Karon,16.77,Putnam Adult,09/02/2014,528
16,9780399162374,Deadline (A Virgil Flowers Novel),John Sandford,16.77,Putnam Adult,10/07/2014,400
17,9780061950728,Orphan Train: A Novel,Christina Baker Kline,8.99,William Morrow Paperbacks,04/02/2013,278
18,9780307341570,Dark Places: A Novel,Gillian Flynn,8.4,Broadway Books,05/04/2010,349
19,9780307962522,Prince Lestat: The Vampire Chronicles,Anne Rice,17.37,Knopf,10/28/2014,480
20,9780385352857,The Narrow Road to the Deep North: A novel,Richard Flanagan,17.04,Knopf,08/12/2014,352
21,9780345535528,"George R. R. Martin's A Game of Thrones 5-Book Boxed Set (Song of Ice and Fire series): A Game of Thrones, A Clash of Kings, A Storm of Swords, A Feast for Crows, and A Dance with Dragons",George R.R. Martin,29.81,Bantam,10/29/2013,5216
22,9780307341556,Sharp Objects: A Novel,Gillian Flynn,8.33,Broadway Books,07/31/2007,254
23,9780440212560,Outlander,Diana Gabaldon,5.99,Dell,06/02/1992,850
24,9780062242358,"Good Dog: True Stories of Love, Loss, and Loyalty",David DiBenedetto,15.28,HarperWave,10/21/2014,336
25,9781607060765,The Walking Dead:  Compendium One,Robert Kirkman,35.7,Image Comics,05/19/2009,1088
26,9780142415436,If I Stay,Gayle Forman,6.01,Speak,04/06/2010,320
27,9780316211048,Burn (Michael Bennett),James Patterson,16.8,"Little, Brown and Company",09/29/2014,432
28,9780316055437,The Goldfinch: A Novel (Pulitzer Prize for Fiction) (National Book Critics Circle Award: Fiction Finalists),Donna Tartt,17.95,"Little, Brown and Company",10/22/2013,775
29,9780425273869,Captivated By You (A Crossfire Novel),Sylvia Day,9.99,Berkley Trade,11/18/2014,368
30,9780446310789,To Kill a Mockingbird,Harper Lee,4.94,Grand Central Publishing,10/11/1988,384
31,9780399167065,Big Little Lies,Liane Moriarty,16.16,Putnam Adult,07/29/2014,480
32,9780307700315,Some Luck: A novel,Jane Smiley,16.95,Knopf,10/07/2014,416
33,9780440215622,Dragonfly in Amber (Outlander),Diana Gabaldon,6.04,Dell,11/02/1993,976
34,9780446547635,The Best of Me,Nicholas Sparks,7.2,Grand Central Publishing,03/26/2013,368
35,9781594633119,The Paying Guests,Sarah Waters,17.37,Riverhead Hardcover,09/16/2014,576
36,9780804178747,Personal (Jack Reacher),Lee Child,16.45,Delacorte Press,09/02/2014,368
37,9781476788005,Grace's Guide: The Art of Pretending to Be a Grown-up,Grace Helbig,11.65,Touchstone,10/21/2014,240
38,9780670024780,The Invention of Wings: A Novel,Sue Monk Kidd,16.71,Viking Adult,01/07/2014,384
39,9781616386108,The Harbinger: The Ancient Mystery That Holds the Secret of America's Future,Jonathan Cahn,8.99,Frontline Pub Inc,01/03/2012,262
40,9780385539708,The Children Act,Ian McEwan,15,Nan A. Talese,09/09/2014,240
41,9781607065968,The Walking Dead: Compendium Two,Robert Kirkman,39.26,Image Comics,10/16/2012,1068
42,9781476728209,The Mistletoe Promise,Richard Paul Evans,13.48,Simon & Schuster,11/18/2014,272
43,9780525953913,Liberators: A Novel of the Coming Global Collapse,James Wesley Rawles,17.61,Dutton Adult,10/21/2014,416
44,9780399159343,The Husband's Secret,Liane Moriarty,14.63,Putnam Adult,07/30/2013,416
45,9780440217565,Voyager (Outlander),Diana Gabaldon,6.04,Dell,10/01/1994,1104
46,9781476729091,The Rosie Project: A Novel,Graeme Simsion,9.87,Simon & Schuster,06/03/2014,320
47,9781476784267,Malice Toward None: Abraham Lincoln's Second Inaugural Address,Jack E. Levin,10.53,Threshold Editions,09/09/2014,64
48,9781617750250,Go the F**k to Sleep,Adam Mansbach,9.23,Akashic Books,06/14/2011,32
49,9781400065677,The Bone Clocks: A Novel,David Mitchell,18,Random House,09/02/2014,640
50,9780143124542,Me Before You: A Novel,Jojo Moyes,9.52,Penguin Books,07/30/2013,400
51,9780743273565,The Great Gatsby,F. Scott Fitzgerald,9,Scribner,09/30/2004,180
52,9781451673319,Fahrenheit 451: A Novel,Ray Bradbury,9.79,Simon & Schuster,01/10/2012,249
53,9781567922813,Missing Person (Verba Mundi) (Verba Mundi Book),Patrick Modiano,16.95,David R Godine,11/30/2004,168
54,9780345804044,"Fifty Shades Trilogy: Fifty Shades of Grey, Fifty Shades Darker, Fifty Shades Freed 3-volume Boxed Set",E L James,27.99,Vintage,06/12/2012,1625
55,9781439138335,Nora Webster: A Novel,Colm Toibin,16.2,Scribner,10/07/2014,384
56,9780385353304,Station Eleven: A novel,Emily St. John Mandel,15.05,Knopf,09/09/2014,352
57,9780307455925,Americanah,Chimamanda Ngozi Adichie,10,Anchor,03/04/2014,608
58,9780375842207,The Book Thief,Markus Zusak,8.52,Alfred A. Knopf,09/11/2007,576
59,9781632150349,The Walking Dead Book 10 HC,Robert Kirkman,23.37,Image Comics,09/09/2014,304
60,9780399501487,Lord of the Flies,William Golding,6,Perigee Books,07/27/1959,208
61,9780452296367,This Is Where I Leave You: A Novel,Jonathan Tropper,9.96,Plume,07/06/2010,352
62,9780553419887,"The Complete Gillian Flynn: Gone Girl, Dark Places, Sharp Objects",Gillian Flynn,28.45,Broadway Books,10/21/2014,1072
63,9780062315007,The Alchemist,Paulo Coelho,10.74,HarperOne,04/15/2014,208
64,9780385344432,Written in My Own Heart's Blood: A Novel (Outlander),Diana Gabaldon,22.27,Delacorte Press,06/10/2014,848
65,9780425247440,What Alice Forgot,Liane Moriarty,8.7,Berkley Trade,04/24/2012,496
66,9780307911544,The Handsome Man's De Luxe Café: No. 1 Ladies' Detective Agency (15),Alexander McCall Smith,17.11,Pantheon,10/28/2014,240
67,9780440224259,Drums of Autumn (Outlander),Diana Gabaldon,6.04,Dell Publishers,11/10/1997,1070
68,9780451524935,1984 (Signet Classics),George Orwell,6,Signet Classic,07/01/1950,328
69,9780062325341,Flesh and Blood: A Scarpetta Novel,Patricia Cornwell,17.87,William Morrow,11/11/2014,384
70,9781476792484,After (The After Series),Anna Todd,9.6,Gallery Books,10/21/2014,592
71,9780345803481,Fifty Shades of Grey: Book One of the Fifty Shades Trilogy,E L James,8.97,Vintage,04/03/2012,514
72,9780385352109,Colorless Tsukuru Tazaki and His Years of Pilgrimage: A novel,Haruki Murakami,15.57,Knopf,08/12/2014,400
73,9781627792103,The Assassination of Margaret Thatcher: Stories,Hilary Mantel,16.2,Henry Holt and Co.,09/30/2014,256
74,9780385538039,Beautiful You: A Novel,Chuck Palahniuk,16.41,Doubleday,10/21/2014,240
75,9780440221661,The Fiery Cross (Outlander),Diana Gabaldon,7.85,Dell,08/30/2005,1443
76,9780142407332,The Outsiders,S. E. Hinton,6.42,Speak,04/20/2006,208
77,9780670026326,The Secret Place (Dublin Murder Squad),Tana French,16.06,Viking Adult,09/02/2014,464
78,9781451681758,The Light Between Oceans: A Novel,M.L. Stedman,9.5,Scribner,04/02/2013,352
79,9780812993868,Shopaholic to the Stars: A Novel,Sophie Kinsella,18.39,The Dial Press,10/21/2014,496
80,9780749717100,Of Mice and Men,John Steinbeck,7.97,Penguin Books,09/01/1993,112
81,9780316769488,The Catcher in the Rye,J.D. Salinger,5.49,"Little, Brown and Company",05/01/1991,224
82,9780553391152,Mr. Miracle: A Christmas Novel,Debbie Macomber,11.88,Ballantine Books,10/07/2014,272
83,9780440225805,A Breath of Snow and Ashes (Outlander),Diana Gabaldon,8.08,Dell,04/29/2008,1488
84,9780399172922,Havana Storm (Dirk Pitt Adventure),Clive Cussler,19.61,Putnam Adult,10/28/2014,464
85,9780451232854,Fall of Giants: Book One of the Century Trilogy,Ken Follett,6.16,Signet,09/04/2012,960
86,9780062293039,"My Drunk Kitchen: A Guide to Eating, Drinking, and Going with Your Gut",Hannah Hart,14.47,Dey Street Books,08/12/2014,240
87,9781476754451,Mr. Mercedes: A Novel,Stephen King,18,Scribner,06/03/2014,448
88,9781452134253,Letters of Note: An Eclectic Collection of Correspondence Deserving of a Wider Audience,Shaun Usher,25.3,Chronicle Books,05/06/2014,352
89,9781101872222,Adulterio (Spanish Edition),Paulo Coelho,15.78,Vintage Espanol,08/19/2014,272
90,9781594486296,Small Victories: Spotting Improbable Moments of Grace,Anne Lamott,16.98,Riverhead Hardcover,11/10/2014,304
91,9780399173356,Tom Clancy Full Force and Effect (A Jack Ryan Novel),Mark Greaney,18.48,Putnam Adult,12/02/2014,688
92,9780307886279,Is Everyone Hanging Out Without Me? (And Other Concerns),Mindy Kaling,11.2,Three Rivers Press,09/18/2012,222
93,9780399166563,Women in Clothes,Sheila Heti,18.98,Blue Rider Press,09/04/2014,528
94,9780440245681,An Echo in the Bone: A Novel (Outlander),Diana Gabaldon,7.91,Dell,05/24/2011,1200
95,9780399158445,The Peripheral,William Gibson,17.69,Putnam Adult,10/28/2014,496
96,9780061561559,Clariel: The Lost Abhorsen (The Old Kingdom),Garth Nix,12.34,HarperCollins,10/14/2014,400
97,9780394551906,You're Only Old Once!: A Book for Obsolete Children (Classic Seuss),Dr. Seuss,12.45,Random House,02/12/1986,56
98,9781476772578,The Means: A Novel,Douglas Brunt,17.54,Touchstone,09/16/2014,352
99,9780399169120,Paris Match (Stone Barrington),Stuart Woods,19.86,Putnam Adult,10/07/2014,320
100,9780345543240,Sycamore Row: A Novel (Jake Brigance),John Grisham,7.23,Dell,08/19/2014,656
101,9780375703768,House of Leaves,Mark Z. Danielewski,14.13,Pantheon,03/07/2000,709
102,9780451468222,Winter of the World: Book Two of the Century Trilogy,Ken Follett,8.13,Signet,08/26/2014,928
103,9780525427919,Wait for Signs: Twelve Longmire Stories,Craig Johnson,16.9,Viking Adult,10/21/2014,192
104,9780062282712,Bad Feminist: Essays,Roxane Gay,9.99,Harper Perennial,08/05/2014,336
105,9781594204791,Blue Horses: Poems,Mary Oliver,17.11,"Penguin Press HC, The",10/14/2014,96
106,9780143125846,The Signature of All Things: A Novel,Elizabeth Gilbert,11.79,Penguin Books,06/24/2014,512
107,9781476756660,We Are Not Ourselves: A Novel,Matthew Thomas,16.8,Simon & Schuster,08/19/2014,640
108,9780399169731,Chasers of the Light: Poems from the Typewriter Series,Tyler Knott Gregson,11.39,Perigee Trade,09/02/2014,144
109,9780312424404,Gilead: A Novel,Marilynne Robinson,9.29,Picador,01/10/2006,247
110,9780374292089,Wolf in White Van: A Novel,John Darnielle,15.56,"Farrar, Straus and Giroux",09/16/2014,224
111,9780871404534,The New Annotated H. P. Lovecraft,H. P. Lovecraft,25.27,Liveright,10/13/2014,928
112,9780385353496,The Zone of Interest: A novel,Martin Amis,17.04,Knopf,09/30/2014,320
113,9780399164767,The Lost Key (A Brit in the FBI),J. T. Ellison,16.33,Putnam Adult,09/30/2014,464
114,9780345538376,"J.R.R. Tolkien 4-Book Boxed Set: The Hobbit and The Lord of the Rings (Movie Tie-in): The Hobbit, The Fellowship of the Ring, The Two Towers, The Return of the King",J.R.R. Tolkien,21.72,Del Rey,09/25/2012,1728
115,9780618706419,The Things They Carried,Tim O'Brien,9.54,Mariner Books,10/13/2009,233
116,9781401324810,Raging Heat (Nikki Heat),Richard Castle,15.51,Kingswell,09/16/2014,304
117,9780345803498,Fifty Shades Darker,E. L. James,8.96,Vintage,04/17/2012,544
118,9781451666175,"Hyperbole and a Half: Unfortunate Situations, Flawed Coping Mechanisms, Mayhem, and Other Things That Happened",Allie Brosh,10.02,Touchstone,10/29/2013,384
119,9780553582017,A Dance with Dragons (A Song of Ice and Fire),George R. R. Martin,8.01,Bantam,10/29/2013,1152
120,451526341,Animal Farm: Anniversary Edition,George Orwell,6.04,Signet Classics,04/01/1996,140
121,9781400032716,The Curious Incident of the Dog in the Night-Time,Mark Haddon,10.35,Vintage,05/18/2004,226
122,9780345803504,Fifty Shades Freed: Book Three of the Fifty Shades Trilogy,E L James,8.98,Vintage,04/17/2012,592
123,9780670026067,The Republic of Imagination: America in Three Books,Azar Nafisi,20.99,Viking Adult,10/21/2014,352
124,9780670025596,The Book of Life: A Novel (All Souls Trilogy),Deborah Harkness,17.26,Viking Adult,07/15/2014,576
125,9780064400558,Charlotte's Web (Trophy Newbery),E. B. White,7.19,HarperCollins,04/10/2012,184
126,9780804139021,The Martian: A Novel,Andy Weir,15.16,Crown,02/11/2014,384
127,9780142180822,We Are All Completely Beside Ourselves: A Novel,Karen Joy Fowler,12.53,Plume,02/25/2014,320
128,9780345530974,Pegasus: A Novel,Danielle Steel,20.52,Delacorte Press,10/28/2014,352
129,9780060850524,Brave New World,Aldous Huxley,8.42,Harper Perennial Modern Classics,10/17/2006,288
130,9781250057174,Robert Kirkman's The Walking Dead: Descent (The Walking Dead Series),Jay Bonansinga,18.58,Thomas Dunne Books,10/14/2014,288
131,9781594486005,A Brief History of Seven Killings: A Novel,Marlon James,19.15,Riverhead Hardcover,10/02/2014,704
132,9780060652937,The Screwtape Letters,C. S. Lewis,8.46,HarperOne,03/03/2009,209
133,9780762457519,"The Pointless Book: Started by Alfie Deyes, Finished by You",Alfie Deyes,9.32,Running Press,10/14/2014,192
134,9780385474542,Things Fall Apart,Chinua Achebe,9.68,Anchor,09/01/1994,209
135,9780345544018,Bones Never Lie: A Novel (Temperance Brennan),Kathy Reichs,18.9,Bantam,09/23/2014,336
136,9780345543127,The Job: A Fox and O'Hare Novel,Janet Evanovich,20.5,Bantam,11/18/2014,304
137,9781250022066,The Long Way Home: A Chief Inspector Gamache Novel,Louise Penny,16.08,Minotaur Books,08/26/2014,384
138,9780345514400,I Know Why the Caged Bird Sings,Maya Angelou,6.24,Ballantine Books,04/21/2009,304
139,9780399164446,Festive in Death,J. D. Robb,16.61,Putnam Adult,09/09/2014,400
140,9781555976903,Citizen: An American Lyric,Claudia Rankine,12.46,Graywolf Press,10/07/2014,160
141,9781312412590,Beautiful Chaos,Robert M. Drake,13.5,lulu.com,08/05/2014,182
142,9781609450786,My Brilliant Friend (Neapolitan),Elena Ferrante,10.75,Europa Editions,09/25/2012,331
143,9781476748047,Zane's Addicted: A Novel,Zane,9.58,Atria Books,08/26/2014,336
144,9780316206877,The Silkworm (A Cormoran Strike Novel),Robert Galbraith,16.09,Mulholland Books,06/19/2014,464
145,9781416971719,Out of My Mind,Sharon M. Draper,6.25,Atheneum Books for Young Readers,05/01/2012,320
146,9780810997417,The Wes Anderson Collection,Matt Zoller Seitz,23.72,Harry N. Abrams,10/08/2013,336
147,9780142403877,The Gruffalo,Julia Donaldson,6,Puffin,03/02/2006,32
148,9781476763125,The Cinderella Murder: An Under Suspicion Novel,Mary Higgins Clark,19.47,Simon & Schuster,11/18/2014,320
149,9781603803403,Star Wars: Imperial Handbook Deluxe Edition,Daniel Wallace,58.49,Becker&mayer! Press,10/14/2014,160
150,9780143117568,Inherent Vice: A Novel,Thomas Pynchon,10.67,Penguin Books,07/27/2010,384
151,9781451696196,The Perks of Being a Wallflower,Stephen Chbosky,8.33,MTV Books,08/14/2012,224
152,9780316201643,S.,J. J. Abrams,35,Mulholland Books,10/29/2013,472
153,9780989768467,Hardpressed (Hacker),Meredith Wild,12.6,Meredith Wild,12/03/2013,286
154,9780142437339,The Crucible,Arthur Miller,8.25,Penguin Classics,03/25/2003,143
155,9781451643534,Ruth's Journey: The Authorized Novel of Mammy from Margaret Mitchell's Gone with the Wind,Donald McCaig,16.45,Atria Books,10/14/2014,384
156,9781250010711,The Silent Sister,Diane Chamberlain,16.59,St. Martin's Press,10/07/2014,352
157,9781476789309,Hyena,Jude Angelini,9.79,Gallery Books,09/23/2014,224
158,9781594631931,Holt McDougal Library: The Kite Runner,Khaled Hosseini,10.67,HOLT MCDOUGAL,03/05/2013,384
159,9780399161490,The Promise: An Elvis Cole and Joe Pike Novel (An Elvis Cole Novel),Robert Crais,17.43,Putnam Adult,04/28/2015,320
160,9780785121794,Civil War,Mark Millar,14.49,Marvel Comics,04/11/2007,208
161,9780679745587,In Cold Blood,Truman Capote,10.09,Vintage,02/01/1994,343
162,9780385324137,The Outlandish Companion,Diana Gabaldon,23.06,Delacorte Press,06/29/1999,608
163,9780140268867,The Odyssey,Bernard Knox,10.17,Penguin Classics,11/01/1997,560
164,9780440180296,Slaughterhouse-Five,Kurt Vonnegut,5.99,Dell,11/03/1991,215
165,9780786965151,"Rise of the King: Companions Codex, II",R. A. Salvatore,17.68,Wizards of the Coast,09/30/2014,368
166,9780307387899,The Road,Cormac McCarthy,9.82,Vintage Books,03/28/2007,287
167,9780440414803,Holes (A Yearling Book),Louis Sachar,6.24,Dell Yearling,05/09/2000,272
168,9781452128306,Goodnight Darth Vader,Jeffrey Brown,9.45,Chronicle Books,07/22/2014,64
169,9781607103134,Grimm's Complete Fairy Tales,Kenneth C. Mondschein,17.45,Canterbury Classics,11/24/2011,652
170,9781439187036,A Sudden Light: A Novel,Garth Stein,18.86,Simon & Schuster,09/30/2014,416
171,9780062236685,This Is the Story of a Happy Marriage,Ann Patchett,12.05,Harper Perennial,10/07/2014,320
172,9780316013697,The Absolutely True Diary of a Part-Time Indian,Sherman Alexie,13.5,"Little, Brown Books for Young Readers",04/01/2009,229
173,9780061537967,The Art of Racing in the Rain: A Novel,Garth Stein,9.67,Harper Paperbacks,06/09/2009,321
174,9781582406190,"The Walking Dead, Book One (Book 1)",Robert Kirkman,24.26,Image Comics,July 2006,304
175,9780062255662,The Ocean at the End of the Lane: A Novel,Neil Gaiman,9.45,William Morrow,06/03/2014,181
176,9780061208492,The Complete C. S. Lewis Signature Classics,C. S. Lewis,19.76,HarperCollins,02/06/2007,752
177,9781477468524,"Unicorns Are Jerks: a coloring book exposing the cold, hard, sparkly truth",Theo Nicole Lorenz,6.92,CreateSpace Independent Publishing Platform,08/29/2012,40
178,9780758278456,What She Left Behind,Ellen Marie Wiseman,11.51,Kensington,12/31/2013,336
179,9781101874080,Adultery: A novel,Paulo Coelho,17.11,Knopf,08/19/2014,272
180,9781451626117,The King's Curse (Cousins' War),Philippa Gregory,20.71,Touchstone,09/09/2014,624
181,9780062276452,Desert God: A Novel of Ancient Egypt,Wilbur Smith,17.89,William Morrow,10/21/2014,432
182,9780399167300,The Eye of Heaven (A Fargo Adventure),Clive Cussler,20.26,Putnam Adult,09/02/2014,400
183,9780307887443,Ready Player One: A Novel,Ernest Cline,9.57,Broadway Books,06/05/2012,384
184,9780425269022,Diary of a Mad Diva,Joan Rivers,16.65,Berkley Hardcover,07/01/2014,304
185,9780547868868,The Best American Short Stories 2014,Jennifer Egan,9.45,Mariner Books,10/07/2014,384
186,9780316204262,"Where'd You Go, Bernadette: A Novel",Maria Semple,13.49,Back Bay Books,04/02/2013,352
187,9781594632389,And the Mountains Echoed,Khaled Hosseini,12.76,Riverhead Trade,06/03/2014,448
188,9780345542922,Top Secret Twenty-One (Stephanie Plum),Janet Evanovich,16.09,Bantam,06/17/2014,341
189,9780062320056,The Heist: A Novel (Gabriel Allon),Daniel Silva,16.79,Harper,07/15/2014,496
190,9780544445789,The Hobbit and The Lord of the Rings: Deluxe Pocket Boxed Set,J.R.R. Tolkien,32.56,Houghton Mifflin Harcourt,10/21/2014,1504
191,9781617753787,You Have to F*****g Eat,Adam Mansbach,9.52,Akashic Books,11/12/2014,32
192,9780679734772,The House on Mango Street,Sandra Cisneros,7.17,Vintage,04/03/1991,110
193,9780345807298,The Circle,Dave Eggers,10.9,Vintage Books,04/22/2014,497
194,9781452106557,Darth Vader and Son,Jeffrey Brown,8.37,Chronicle Books,04/18/2012,64
195,9781405914000,Doctor Who: Essential Guide to 50 Years of Doctor Who,Justin Richards,12.65,PENGUIN GROUP,11/19/2013,208
196,9780679720201,The Stranger,Albert Camus,8.39,Vintage,03/13/1989,123
197,9781250045645,Seventh Grave and No Body (Charley Davidson),Darynda Jones,16.73,St. Martin's Press,10/21/2014,336
198,9780345539939,As Chimney Sweepers Come to Dust: A Flavia de Luce Novel,Alan Bradley,15.6,Delacorte Press,01/06/2015,416
199,9780060883287,One Hundred Years of Solitude (P.S.),Gabriel Garcia Marquez,9.03,Harper Perennial Modern Classics,02/21/2006,417
200,9780439139601,Harry Potter And The Goblet Of Fire,J.K. Rowling,8.99,Scholastic Paperbacks,07/30/2002,752
201,9781455581122,Mean Streak,Sandra Brown,23.4,Grand Central Publishing,08/19/2014,416
202,9781609414115,The Shack,Wm. Paul Young,7.2,Windblown Media,06/01/2011,304
203,9780307273604,Daily Rituals: How Artists Work,Mason Currey,15.06,Knopf,04/23/2013,304
204,9780761165781,"The Best of the Rejection Collection: 293 Cartoons That Were Too Dumb, Too Dark, or Too Naughty for The New Yorker",Matthew Diffee,10.82,Workman Publishing Company,10/19/2011,320
205,9780385349079,Dad Is Fat,Jim Gaffigan,10.11,Three Rivers Press,04/22/2014,288
206,9781449461072,Lullabies,Lang Leav,10.74,Andrews McMeel Publishing,09/16/2014,248
207,9780312428549,Home: A Novel,Marilynne Robinson,9.34,Picador,09/01/2009,336
208,9780743297332,The Sun Also Rises,Ernest Hemingway,8.48,Scribner,10/17/2006,251
209,9780425259863,Shadow Spell (Cousins O'Dwyer),Nora Roberts,10.11,Berkley,03/25/2014,352
210,9780743477123,Hamlet ( Folger Library Shakespeare),William Shakespeare,4.77,Simon & Schuster,07/01/2003,342
211,9780439785969,Harry Potter and the Half-Blood Prince (Book 6),J.K. Rowling,7.86,Scholastic Paperbacks,07/25/2006,652
212,9780989768412,Hardwired,Meredith Wild,12.54,Meredith Wild LLC,09/02/2013,326
213,9781616203214,The Storied Life of A. J. Fikry: A Novel,Gabrielle Zevin,16.86,Algonquin Books,04/01/2014,272
214,9780990505600,Hardline (Hacker),Meredith Wild,12.6,Meredith Wild,06/13/2014,262
215,9781400031702,The Secret History,Donna Tartt,9.01,Vintage,04/13/2004,576
216,9781439177723,I Am Pilgrim: A Thriller,Terry Hayes,17.07,Atria/Emily Bestler Books,05/27/2014,624
217,9780684801223,The Old Man and The Sea,Ernest Hemingway,6.78,Scribner,05/05/1995,128
218,9780300198058,Suspended Sentences: Three Novellas (The Margellos World Republic of Letters),Patrick Modiano,12.97,Yale University Press,11/11/2014,232
219,9780451469663,Only Enchanting: A Survivors' Club Novel,Mary Balogh,5.53,Signet,10/28/2014,400
220,9780547928227,"The Hobbit; or, There and Back Again",J. R. R. Tolkien,9.48,Houghton Mifflin Harcourt,09/18/2012,300
221,9780767905923,"Tuesdays with Morrie: An Old Man, a Young Man, and Life's Greatest Lesson",Mitch Albom,8.44,Broadway Books,10/08/2002,192
222,9781250010650,The Christmas Light,Donna VanLiere,13.48,St. Martin's Press,10/14/2014,224
223,9780399170874,Obsession in Death,J. D. Robb,17.43,Putnam Adult,02/10/2015,416
224,9780385539128,Stone Mattress: Nine Tales,Margaret Atwood,16.41,Nan A. Talese,09/16/2014,288
225,9780374152017,Faithful and Virtuous Night: Poems,Louise Glück,14.19,"Farrar, Straus and Giroux",09/09/2014,80
226,9780765338365,An Irish Doctor in Peace and at War: An Irish Country Novel (Irish Country Books),Patrick Taylor,16.7,Forge Books,10/14/2014,416
227,9780062297211,The Monogram Murders: The New Hercule Poirot Mystery (Hercule Poirot Mysteries),Sophie Hannah,14.93,William Morrow,09/09/2014,320
228,9780679723165,Lolita,Vladimir Nabokov,9.57,Vintage,03/13/1989,317
229,9780060589462,Zen and the Art of Motorcycle Maintenance: An Inquiry Into Values,Robert M. Pirsig,6,HarperTorch,04/25/2006,560
230,9780765356864,One Second After,William R. Forstchen,8.51,Tor Books,04/26/2011,528
231,9781451627299,11/22/63: A Novel,Stephen King,11.29,Gallery Books,07/24/2012,880
232,9780765326362,"Words of Radiance (The Stormlight Archive, Book 2) (Stormlight Archive, The)",Brandon Sanderson,20.29,Tor Books,03/04/2014,1088
233,9780756404741,The Name of the Wind (Kingkiller Chronicle),Patrick Rothfuss,7.99,DAW Books,04/01/2008,722
234,9780778316640,'Tis The Season: Under the Christmas Tree\Midnight Confessions\Backward Glance,Robyn Carr,5.78,Harlequin MIRA,10/28/2014,336
235,9780143039433,The Grapes of Wrath,John Steinbeck,11.11,Penguin Classics,03/28/2006,464
236,9780393327342,Fight Club: A Novel,Chuck Palahniuk,8.44,W. W. Norton,10/17/2005,224
237,9781439110003,The Bro Code,Barney Stinson,8.39,Fireside,10/14/2008,195
238,9780670015672,The Magician's Land: A Novel (Magicians Trilogy),Lev Grossman,17.49,Viking Adult,08/05/2014,416
239,9781451687477,Angels Walking: A Novel,Karen Kingsbury,15.5,Howard Books,09/02/2014,384
240,9780062335975,How to Build a Girl: A Novel,Caitlin Moran,17.07,Harper,09/23/2014,352
241,9780385351836,One More Thing: Stories and Other Stories,B. J. Novak,15.25,Knopf,02/04/2014,288
242,9780615590585,The Pecan Man,Cassie Dandridge Selleck,8.99,The Pecan Man,01/01/2012,144
243,9780307956996,Perfidia: A novel,James Ellroy,17.8,Knopf,09/09/2014,720
244,9781400079155,Inferno (Robert Langdon),Dan Brown,7.83,Anchor,05/06/2014,624
245,9780451241160,Immortal: A Novel of the Fallen Angels,J.R. Ward,17.68,NAL Hardcover,10/07/2014,400
246,9781455529780,Private Down Under,James Patterson,11.84,Grand Central Publishing,08/26/2014,384
247,9780991379651,The Fixed Trilogy,Laurelin Paige,21.88,Paige Press,04/10/2014,794
248,9781625781543,Day of Wrath,William R. Forstchen,6.99,"Spectrum Literary Agency, Inc.",08/29/2014,188
249,9781416957768,The 7 Habits of Happy Kids,Sean Covey,13.1,Simon & Schuster Books for Young Readers,09/16/2008,96
250,9780452011878,Atlas Shrugged,Ayn Rand,17.14,Plume,08/01/1999,1200
