id:INTEGER,ISBN_13,Title,Author,Price:FLOAT,Publisher,Publication_date,Pages:INTEGER
2531,9781593703196,Pass It On: What We Know What We Want You to Know!,Billy Goldfeder,41.27,Pennwell Corp,03/24/2014,444
2532,9781118772942,Samsung Galaxy Tabs For Dummies,Dan Gookin,15.72,For Dummies,12/31/2013,320
2533,9781593702335,Collapse of Burning Buildings: A Guide to Fireground Safety,Vincent Dunn,45.51,Fire Engineering Books & Videos,10/01/2010,364
2534,9781603583282,From the Wood-Fired Oven: New and Traditional Techniques for Cooking and Baking with Fire,Richard Miscovich,31.76,Chelsea Green Publishing,10/10/2013,352
2535,9780143112709,The Works: Anatomy of a City,Kate Ascher,14.36,Penguin Books,11/27/2007,240
2536,9780691147451,The Transformation of the World: A Global History of the Nineteenth Century (America in the World),Jürgen Osterhammel,27.44,Princeton University Press,04/13/2014,1192
2537,9780071742474,"Roark's Formulas for Stress and Strain, 8th Edition",Ali Sadegh,104.1,McGraw-Hill Professional,11/28/2011,1072
2538,9781561585304,"Running a Successful Construction Company (For Pros, by Pros)",David Gerstel,16.13,Taunton Press,11/01/2002,265
2539,9780881889000,The Sound Reinforcement Handbook,Gary Davis,20.35,Yamaha,01/01/1988,420
2540,9780465044979,The Big Ratchet: How Humanity Thrives in the Face of Natural Crisis,Ruth DeFries,19.03,Basic Books,09/09/2014,288
2541,9780077366742,Thermodynamics: An Engineering Approach with Student Resources DVD,Yunus Cengel,251.35,McGraw-Hill Science/Engineering/Math,01/25/2010,1056
2542,9781118723067,iPad For Dummies,Edward C. Baig,15.4,For Dummies,12/23/2013,384
2543,9781932494426,Engine Management: Advanced Tuning,Greg Banish,18.97,CarTech,04/10/2007,128
2544,9780884271536,Critical Chain,Eliyahu M. Goldratt,13.78,The North River Press,01/01/1997,246
2545,9780691136400,The Box: How the Shipping Container Made the World Smaller and the World Economy Bigger,Marc Levinson,11.74,Princeton University Press,01/27/2008,400
2546,9780133109818,Fire and Emergency Services Instructor,IFSTA,80.32,Pearson Educacion,06/01/2012,504
2547,9780470147047,Electronics All-in-One For Dummies,Doug Lowe,21.12,For Dummies,02/01/2012,872
2548,9780978802202,Industrial Hydraulics Manual 5th Ed. 2nd Printing,Eaton Hydraulics Training Services (Vickers),49.93,Eaton Hydraulics Training Services,04/01/2008,642
2549,9781889269009,"A Timber Framer's Workshop: Joinery, Design & Construction of Traditional Timber Frames",Steve Chappell,27.06,Fox Maple Press,06/01/2011,272
2550,9780495604204,Interpersonal Process in Therapy: An Integrative Model,Edward Teyber,151.58,Cengage Learning,06/17/2010,512
2551,9781563926129,OBD-II & Electronic Engine Management Systems (Haynes Techbook),Bob Henderson,17.37,"Haynes Manuals N. America, Inc.",11/01/2006,272
2552,9781118919316,Teach Yourself VISUALLY Samsung Galaxy S5,Guy Hart-Davis,20,Visual,07/21/2014,352
2553,9780471309321,Classical Electrodynamics Third Edition,John David Jackson,108.25,Wiley,08/10/1998,832
2554,9780123943989,"Essential MATLAB for Engineers and Scientists, Fifth Edition",Brian Hahn,35.62,Academic Press,01/24/2013,424
2555,9780937100257,Performance Management: Changing Behavior that Drives Organizational Performance,Aubrey C. Daniels,47.7,Performance Management Publications,04/15/2014,344
2556,9780538733526,Probability and Statistics for Engineering and the Sciences,Jay L. Devore,185.87,Cengage Learning,01/01/2011,768
2557,9781118289402,"Group Policy: Fundamentals, Security, and the Managed Desktop",Jeremy Moskowitz,33.52,Sybex,01/04/2013,912
2558,9781609830700,2012 International Plumbing Code Commentary,International Code Council,81.74,ICC,04/23/2012,1
2559,9780132319706,Guide to NATE/ICE Certification Exams (3rd Edition),Robert Featherstone,60.45,Prentice Hall,01/07/2009,408
2560,9781589237216,Black & Decker Codes for Homeowners: Electrical  Mechanical  Plumbing  Building Updated through 2014 (Black & Decker Complete Guide),Bruce Barker,16.99,Cool Springs Press,11/01/2012,240
2561,9781885254009,Delirious New York: A Retroactive Manifesto for Manhattan,Rem Koolhaas,21.08,The Monacelli Press,12/01/1997,320
2562,9781561584703,Building Kitchen Cabinets (Taunton's Build Like a Pro),Udo Schmidt,15.11,Taunton Press,04/01/2003,176
2563,9780073398235,Mechanics of Materials,David Mazurek,249.58,McGraw-Hill Science/Engineering/Math,01/24/2014,896
2564,9781449313876,Arduino Cookbook,Michael Margolis,26.87,O'Reilly Media,12/30/2011,724
2565,9780972993456,Smoke your Firefighter Interview,Paul S. Lepore,20.18,Freespool Publications,12/02/2011,360
2566,9780071790352,"Gemba Kaizen: A Commonsense Approach to a Continuous Improvement Strategy, Second Edition",Masaaki Imai,24.78,McGraw-Hill Professional,06/13/2012,448
2567,9781438001319,"Barron's Firefighter Candidate Exams, 7th Edition",James Murtagh,11.32,Barron's Educational Series,02/01/2013,456
2568,9780345376596,Pale Blue Dot: A Vision of the Human Future in Space,Carl Sagan,9.95,Ballantine Books,09/08/1997,384
2569,9780671207144,The Johnstown Flood,David McCullough,11.53,Simon & Schuster,01/15/1987,304
2570,9780486600611,Fundamentals of Astrodynamics (Dover Books on Aeronautical Engineering),Roger  R. Bate,12.61,Dover Publications,06/01/1971,455
2571,9781133314165,Fundamentals of Case Management Practice: Skills for the Human Services,Nancy Summers,122.66,Cengage Learning,07/20/2011,496
2572,9780964425835,"The Humanure Handbook: A Guide to Composting Human Manure, Third Edition",Joseph C. Jenkins,18.43,"Joseph Jenkins, Inc.",09/01/2005,256
2573,9781593700522,Oil & Gas Production in Nontechnical Language,William L. Leffler,61.22,PennWell Corp.,10/10/2005,221
2574,9781782008071,Savoia-Marchetti S.79 Sparviero Torpedo-Bomber Units (Combat Aircraft),Marco Mattioli,17.34,Osprey Publishing,10/21/2014,96
2575,9781587133169,Introduction to Networks Companion Guide,Cisco Networking Academy,53.76,Cisco Press,12/30/2013,720
2576,9780071816786,Tableau 8: The Official Guide,George Peck,23.29,McGraw-Hill Osborne Media,08/20/2013,230
2577,9780471182092,An Introduction to Fluid Dynamics: Principles of Analysis and Design,Stanley Middleman,139.44,Wiley,10/02/1997,528
2578,9780763758363,Exam Prep: Fire Fighter I And II,"Dr.  Ben Hirst, Performance Training Systems",48.89,Jones & Bartlett Learning,05/29/2009,276
2579,9780486437477,"Shelters, Shacks, and Shanties: The Classic Guide to Building Wilderness Shelters (Dover Books on Architecture)",D. C. Beard,8.66,Dover Publications,09/10/2004,256
2580,9780486676203,Partial Differential Equations for Scientists and Engineers (Dover Books on Mathematics),Stanley J. Farlow,10.83,Dover Publications,09/01/1993,448
2581,9781592538485,The Architecture Reference & Specification Book: Everything Architects Need to Know Every Day,Julia McMorrough,18.5,Rockport Publishers,08/01/2013,272
2582,9780073380247,Introduction to Flight,John Anderson,222.32,McGraw-Hill Science/Engineering/Math,03/07/2011,944
2583,9781593275099,The Practice of Network Security Monitoring: Understanding Incident Detection and Response,Richard Bejtlich,31.24,No Starch Press,08/05/2013,376
2584,9780385334969,Biohazard: The Chilling True Story of the Largest Covert Biological Weapons Program in the World--Told from Inside by the Man Who Ran It,Ken Alibek,11.34,Delta,04/11/2000,336
2585,9780071418218,Lean Six Sigma for Service : How to Use Lean Speed and Six Sigma Quality to Improve Services and Transactions,Michael George,22.29,McGraw-Hill,07/15/2003,300
2586,9781612650180,"LEED v4 Green Associate Exam Guide (LEED GA): Comprehensive Study Materials, Sample Questions, Green Building LEED Certification, and Sustainability (Green Associate Exam Guide Series) (Volume 1)",Gang Chen,49.98,"ArchiteG, Incorporated",08/01/2014,186
2587,9780300176490,"Water 4.0: The Past, Present, and Future of the Worlds Most Vital Resource",David Sedlak,18.68,Yale University Press,01/28/2014,352
2588,9780471687573,Elementary Principles of Chemical Processes,Richard M. Felder,93.8,Wiley,12/15/2004,702
2589,9780345345059,A Sand County Almanac (Outdoor Essays & Reflections),Aldo Leopold,7.19,Ballantine Books,12/12/1986,320
2590,9780970954428,"Global Positioning System: Signals, Measurements, and Performance (Revised Second Edition)",Per Enge,72.29,Ganga-Jamuna Press,12/01/2010,590
2591,9781585038534,SolidWorks 2014 Part I - Basic Tools,Paul Tran,67.5,SDC Publications,01/02/2014,724
2592,9780321693457,"Chemistry: An Introduction to General, Organic, and Biological Chemistry (11th Edition)",Karen C. Timberlake,23.11,Prentice Hall,01/06/2011,744
2593,9780138147570,Signals and Systems (2nd Edition),Alan V. Oppenheim,177.92,Prentice Hall,08/16/1996,957
2594,9780307386045,Where Men Win Glory: The Odyssey of Pat Tillman,Jon Krakauer,12.93,Anchor,07/27/2010,480
2595,9780814743508,Spreadable Media: Creating Value and Meaning in a Networked Culture (Postmillennial Pop),Henry Jenkins,21.04,NYU Press,01/21/2013,352
2596,9780898158960,The Complete Modern Blacksmith,Alexander Weygers,14.57,Ten Speed Press,02/01/1997,304
2597,9780789753496,My Samsung Galaxy S5,Steve Schwartz,15.24,Que Publishing,07/24/2014,656
2598,9780760344262,"Area 51 - Black Jets: A History of the Aircraft Developed at Groom Lake, America's Secret Aviation Base",Bill Yenne,29.22,Zenith Press,03/15/2014,192
2599,9780062353566,"Ships, Clocks, and Stars: The Quest for Longitude",Richard Dunn,50.09,Harper Design,11/04/2014,256
2600,9781591264156,Practice Problems for the Mechanical Engineering PE Exam: A Companion to the Mechanical Engineering Reference Manual (Comprehensive Practice for the Mechanical Pe Exam),Michael  R. Lindeburg PE,94.52,"Professional Publications, Inc.",04/15/2013,584
2601,9781111645694,"Medium/Heavy Duty Truck Engines, Fuel & Computerized Management Systems",Sean Bennett,195.58,Cengage Learning,02/02/2012,1008
2602,9781118862858,Mastering Autodesk Revit Architecture 2015: Autodesk Official Press,Eddy Krygiel,53.21,Sybex,06/03/2014,992
2603,9780486443607,507 Mechanical Movements: Mechanisms and Devices (Dover Science Books),Henry T. Brown,8.06,Dover Publications,08/15/2005,128
2604,9780131988422,Discrete-Time Signal Processing (3rd Edition) (Prentice Hall Signal Processing),Alan V. Oppenheim,190.73,Prentice Hall,08/28/2009,1120
2605,9781119953708,Lean Six Sigma For Dummies,John Morgan,16.64,For Dummies,04/30/2012,320
2606,9781491947326,"iMovie: The Missing Manual: 2014 release, covers iMovie 10.0 for Mac and 2.0 for iOS (Missing Manuals)",David Pogue,24.29,O'Reilly Media,06/02/2014,432
2607,9781440232671,Gun Digest Book of Concealed Carry,Massad F. Ayoob,16.79,Gun Digest Books,10/22/2012,256
2608,9781780282992,The Art of War: The New Illustrated Edition (The Art of Wisdom),Sun Tzu,16.71,Duncan Baird,05/01/2012,272
2609,9780071770187,Troubleshooting and Repairing Major Appliances,Eric Kleinert,40.81,Tab Books,09/26/2012,1192
2610,9780984521401,Kanban: Successful Evolutionary Change for Your Technology Business,David J. Anderson,39.71,Blue Hole Press,04/07/2010,278
2611,9780486217093,Basic Machines and How They Work,Naval Education And Training Program,9.45,Dover Publications,06/01/1971,128
2612,9781118146811,Statistical Quality Control,Douglas C. Montgomery,149.18,Wiley,06/19/2012,768
2613,9780240818962,Mastering Audio: The Art and the Science,Bob Katz,35.78,Focal Press,09/25/2014,408
2614,9781580012515,2006 International Building Code - Softcover Version: Softcover Version (International Building Code),International Code Council,110.61,ICC,03/06/2006,666
2615,9781111969608,"Database Systems: Design, Implementation, and Management (with Premium WebSite Printed Access Card and Essential Textbook Resources Printed Access Card)",Carlos Coronel,67,Cengage Learning,01/01/2012,752
2616,9781620406663,The Bridge: The Building of the Verrazano-Narrows Bridge,Gay Talese,28,Bloomsbury USA,10/28/2014,192
2617,9781856697491,Making It: Manufacturing Techniques for Product Design,Chris Lefteri,26.13,Laurence King Publishing,03/26/2012,288
2618,9781607743880,"The New World Champion Paper Airplane Book: Featuring the World Record-Breaking Design, with Tear-Out Planes to Fold and Fly",John M. Collins,13.33,Ten Speed Press,03/26/2013,160
2619,9780789750884,CCNA Routing and Switching 200-120 Network Simulator,Wendell Odom,124.94,Pearson IT Certification,12/29/2013,500
2620,9781111127060,ASE Test Preparation - A4 Suspension and Steering (Automobile Certification Series),Delmar,18.98,Cengage Learning,06/24/2011,224
2621,9780470531082,"Digital Design with RTL Design, VHDL, and Verilog",Frank Vahid,191.88,Wiley,03/09/2010,592
2622,9781585038893,Residential Design Using Autodesk Revit 2015,Daniel John Stine,47.73,SDC Publications,05/01/2014,515
2623,9780470631553,Microwave Engineering,David M. Pozar,77.95,Wiley,11/22/2011,720
2624,9780500516768,Things Come Apart: A Teardown Manual for Modern Living,Todd McLellan,20.23,Thames & Hudson,05/31/2013,128
2625,9780977246434,"Rainwater Harvesting for Drylands and Beyond, Volume 1, 2nd Edition: Guiding Principles to Welcome Rain into Your Life and Landscape",Brad Lancaster,20.14,Rainsource Press,07/01/2013,304
2626,9780137027415,Understanding Digital Signal Processing (3rd Edition),Richard G. Lyons,84.27,Prentice Hall,11/11/2010,984
2627,9781593273835,The Book of GIMP: A Complete Guide to Nearly Everything,Olivier Lecarme,31.33,No Starch Press,01/25/2013,676
2628,9780879392819,Fire and Emergency Services Company Officer,Frederick M. Stowell,42.15,Intl Fire Service Training Assn,04/12/2007,908
2629,9781593703080,Step Up and Lead,Frank Viscuso,52.89,Pennwell Pub,03/31/2013,271
2630,9781435498266,Electrical Wiring Residential,Ray C. Mullin,94.32,Cengage Learning,01/01/2011,816
2631,9781580017350,2009 International Fuel Gas Code: Softcover Version,International Code Council,58.52,ICC,03/02/2009,166
2632,9780964343368,"Water Storage: Tanks, Cisterns, Aquifers, and Ponds for Domestic Supply, Fire and Emergency Use--Includes How to Make Ferrocement Water Tanks",Art Ludwig,14.85,Oasis Design,05/30/2005,125
2633,9780967984674,"Build Your Own Earth Oven: A Low-Cost Wood-Fired Mud Oven, Simple Sourdough Bread, Perfect Loaves, 3rd Edition",Alan Scott,14.99,Hand Print Press,April 2007,132
2634,9781589483569,GIS Tutorial for Python Scripting,David W. Allen,44.03,Esri Press,07/24/2014,265
2635,9781449387860,Network Warrior,Gary A. Donahue,29.56,O'Reilly Media,06/02/2011,788
2636,9781118862155,Autodesk Revit Architecture 2015: No Experience Required: Autodesk Official Press,Eric Wing,37.77,Sybex,06/03/2014,1008
2637,9780521517423,Biodesign: The Process of Innovating Medical Technologies,Thomas M. Krummel,99,Cambridge University Press,09/25/2009,806
2638,9781587143045,NX-OS and Cisco Nexus Switching: Next-Generation Data Center Architectures (2nd Edition) (Networking Technology),Ron Fuller,50.66,Cisco Press,03/23/2013,864
2639,9781118772652,Kindle Fire HDX For Dummies,Nancy C. Muir,15.15,For Dummies,12/10/2013,288
2640,9781893939943,Wireshark Network Analysis (Second Edition): The Official Wireshark Certified Network Analyst Study Guide,Laura Chappell,92.2,Laura Chappell University,03/01/2012,986
2641,9780135090497,Technical Drawing with Engineering Graphics (14th Edition),Marla Goodman,120.43,Peachpit Press,01/07/2011,936
2642,9781111127039,ASE Test Preparation - A1 Engine Repair (Delmar Learning's Ase Test Prep Series),Delmar,19.68,Cengage Learning,06/07/2011,256
2643,9781118086834,Business Data Communications and Networking,Jerry FitzGerald,55.18,Wiley,08/23/2011,608
2644,9781454707608,iPad for Artists: How to Make Great Art with Your Tablet,Dani Jones,12,Pixiq,01/08/2013,144
2645,9780470455968,Welding For Dummies,Steven Robert Farnsworth,19.25,For Dummies,10/04/2010,384
2646,9780071821582,Raspberry Pi Projects for the Evil Genius,Donald Norris,15.25,McGraw-Hill/TAB Electronics,08/14/2013,224
2647,9780964343399,"The New Create an Oasis with Greywater: Choosing, Building and Using Greywater Systems - Includes Branched Drains",Art Ludwig,15.52,Oasis Design,09/01/2006,144
2648,9781589483514,Esri ArcGIS Desktop Associate Certification Study Guide,Miriam Schmidts,49.18,Esri Press,11/23/2013,450
2649,9781589236011,"Black & Decker The Complete Guide to Wiring, 5th Edition: Current with 2011-2013 Electrical Codes (Black & Decker Complete Guide)",Editors of CPi,18.17,Creative Publishing international,05/01/2011,352
2650,9780143122791,The Idea Factory: Bell Labs and the Great Age of American Innovation,Jon Gertner,10.86,Penguin Books,02/26/2013,432
2651,9781572182554,Electrician's Exam Preparation Guide to the 2011 NEC,John E. Traister,31.13,Craftsman Book Company,03/01/2011,350
2652,9780132911276,Engineering Mechanics: Dynamics (13th Edition),Russell C. Hibbeler,177.36,Prentice Hall,04/21/2012,768
2653,9780199778126,Engineering Economic Analysis,Donald Newnan,40.52,Oxford University Press,02/03/2011,672
2654,9780201543933,Semiconductor Device Fundamentals,Robert F. Pierret,176.09,Addison Wesley,04/12/1996,792
2655,9780826943156,High Pressure Boilers,Frederick M. Steingress,114,Amer Technical Pub,06/29/2012,344
2656,9780393330328,Six Frigates: The Epic History of the Founding of the U.S. Navy,Ian W. Toll,14.05,W. W. Norton & Company,03/17/2008,592
2657,9780983908500,"A Dictionary of Civil, Water Resources & Environmental Engineering",Harry C Friebel,47.72,Golden Ratio Publishing,01/01/2013,468
2658,9781621452010,The Complete Do-it-Yourself Manual Newly Updated,Editors Of Family Handyman,26.35,Readers Digest,10/07/2014,528
2659,9781609830588,2012 International Energy Conservation Code,International Code Council,37.68,ICC,07/11/2011,90
2660,9780077826260,Mastering ArcGIS with Video Clips DVD-ROM,Maribeth Price,124.18,McGraw-Hill Science/Engineering/Math,03/21/2013,611
2661,9781111127084,ASE Test Preparation - A6 Electricity and Electronics (Ase Test Preparation Series),Delmar,16.94,Cengage Learning,06/20/2011,240
2662,9780470547847,Fundamentals of Biochemistry: Life at the Molecular Level,Donald Voet,168.59,Wiley,01/11/2012,1200
2663,9781939529824,Get A Grip: How to Get Everything You Want from Your Entrepreneurial Business,Gino Wickman,11.7,BenBella Books,04/08/2014,320
2664,9781118146927,Design and Analysis of Experiments,Douglas C. Montgomery,141.94,Wiley,04/10/2012,752
2665,9780684824147,Dark Sun: The Making of the Hydrogen Bomb,Richard Rhodes,14.87,Simon & Schuster,08/06/1996,736
2666,9781449601621,Fire Officer: Principles And Practice,IAFC,65.64,Jones & Bartlett Learning,08/19/2010,394
2667,9780979387364,"Newton's Telecom Dictionary: Telecommunications, Networking, Information Technologies, The Internet, Wired, Wireless, Satellites and Fiber",Harry Newton,26.43,Flatiron Publishing,02/01/2013,1344
2668,9781133283362,"Building Code Basics, Residential: Based on the 2012 International Residential Code (International Code Council)",International Code Council,27.97,Cengage Learning,05/25/2012,288
2669,9780826992277,Photovoltaic Systems,James P. Dunlop,123.5,Amer Technical Pub,10/01/2012,512
2670,9780760344927,Professional Sheet Metal Fabrication (Motorbooks Workshop),Ed Barr,25.68,Motorbooks,04/30/2013,304
2671,9780470501962,Introduction to Heat Transfer,David P. DeWitt,186.97,Wiley,06/07/2011,992
2672,9780879122812,"Accident Prevention Manual for Business & Industry: Engineering & Technology, 13th Edition (Occupational Safety and Health)",Philip Hagan,130.74,National Safety Council,01/12/2009,888
2673,9781449690762,"Ugly's Electric Motors And Controls, 2014 Edition",Jones & Bartlett Learning,21.55,Jones & Bartlett Learning,02/17/2014,126
2674,9781605257952,Modern Welding,Mark A. Bowditch,88.71,Goodheart-Willcox,06/06/2012,896
2675,9780879393717,Building Construction Related to the Fire Service,International Fire Service Training Asso,53.95,Intl Fire Service Training Assn,06/30/2010,439
2676,9780123745187,"Human Factors in Aviation, Second Edition",Dan Maurino,107.99,Academic Press,02/10/2006,744
2677,9780131481930,Introduction to Environmental Engineering and Science (3rd Edition),Gilbert M. Masters,172.75,Prentice Hall,06/18/2007,720
2678,9781572182714,"Markup & Profit: A Contractor's Guide, Revisited",Michael C. Stone,33.93,Craftsman Book Company,04/01/2012,332
2679,9780857334053,"Soyuz Owners' Workshop Manual: 1967 onwards (all models) - An insight into Russia's flagship spacecraft, from Moon missions to the International Space Station",David Baker,21.43,Haynes Publishing UK,10/01/2014,176
2680,9780465061839,The Creative Destruction of Medicine: How the Digital Revolution Will Create Better Health Care,Eric Topol M.D.,13.7,Basic Books,08/13/2013,336
2681,9781419712555,Climate Changed: A Personal Journey through the Science,Philippe Squarzoni,16.09,Harry N. Abrams,04/08/2014,480
2682,9780879122805,"Accident Prevention Manual for Business & Industry: Administration and Programs, 13th Edition (Occupational Safety & Health Series)",Philip Hagan,189.38,National Safety Council,01/12/2009,848
2683,9780692202272,Amazon Fire TV User Manual: Guide to Unleash Your Streaming Media Device,Shelby Johnson,6.52,RAM Internet Media,04/13/2014,72
2684,9780911469271,The Art of the Stonemason,Ian Cramb,17.02,"Alan C. Hood & Company, Inc.",02/15/2006,174
2685,9781616890186,The Business of Design,Keith Granet,25,Princeton Architectural Press,08/24/2011,208
2686,9781111038748,"Electricity for Refrigeration, Heating, and Air Conditioning",Russell E. Smith,93.55,Cengage Learning,06/24/2010,736
2687,9781593700584,Oil & Gas Pipelines in Nontechnical Language,Thomas O. Miesner,64.44,PennWell Corp.,03/15/2006,357
2688,9780756682576,LEGO Harry Potter: Building the Magical World,Elizabeth Dowsett,17.63,DK CHILDREN,05/16/2011,96
2689,9780470598931,Photovoltaic Design and Installation For Dummies,Ryan Mayfield,16.67,For Dummies,09/07/2010,384
2690,9780195024029,The Timeless Way of Building,Christopher Alexander,40,Oxford University Press,1979,552
2691,9781429283601,"Biochemistry: A Short Course, 2nd Edition",John L. Tymoczko,176.87,W. H. Freeman,12/23/2011,800
2692,9780470115398,"Transport Phenomena, Revised 2nd Edition",Edwin N. Lightfoot,144.25,"John Wiley & Sons, Inc.",12/11/2006,905
2693,9781612120850,"The Backyard Homestead Book of Building Projects: 76 Useful Things You Can Build to Create Customized Working Spaces and Storage Facilities, Equip the ... Animals, and Make Practical Outdoor Furniture",Spike Carlsen,19,"Storey Publishing, LLC",03/25/2014,296
2694,9781561584789,Trim Carpentry and Built-Ins: Taunton's BLP: Expert Advice from Start to Finish (Taunton's Build Like a Pro),Andrew Wormer,15.11,Taunton Press,10/01/2002,176
2695,9780945053804,Technician Class 2014-2018 study manual with HamStudy software,K0RTX,26.94,The W5YI Group,05/01/2014,256
2696,9781782003953,Panzer 38(t) (New Vanguard),Steven Zaloga,14.19,Osprey Publishing,10/21/2014,48
2697,9780132496346,An Introduction to Geotechnical Engineering (2nd Edition),William D. Kovacs,177.38,Prentice Hall,10/28/2010,864
2698,9780262013192,Probabilistic Graphical Models: Principles and Techniques (Adaptive Computation and Machine Learning series),Daphne Koller,99.75,The MIT Press,07/31/2009,1280
2699,9781472802552,The M14 Battle Rifle (Weapon),Leroy Thompson,14.81,Osprey Publishing,10/21/2014,80
2700,9781400046959,The Warrior Elite: The Forging of SEAL Class 228,Dick Couch,12.24,Three Rivers Press,01/28/2003,384
2701,9781118690833,iPhone For Dummies,Edward C. Baig,15.07,For Dummies,11/04/2013,416
2702,9781563273605,Understanding A3 Thinking: A Critical Component of Toyota's PDCA Management System,Art Smalley,42.23,Productivity Press,03/07/2008,184
2703,9780307886729,"Trapped Under the Sea: One Engineering Marvel, Five Men, and a Disaster Ten Miles Into the Darkness",Neil Swidey,18.23,Crown,02/18/2014,432
2704,9780486607542,Mechanics (Dover Books on Physics),J. P. Den Hartog,3.99,Dover Publications,06/01/1961,480
2705,9780199737505,Out of the Mountains: The Coming Age of the Urban Guerrilla,David Kilcullen,20.93,Oxford University Press,10/01/2013,352
2706,9781593276003,The LEGO MINDSTORMS EV3 Idea Book: 181 Simple Machines and Clever Contraptions,Yoshihito Isogawa,18.56,No Starch Press,11/20/2014,232
2707,9781940238043,RSMeans Electrical Cost Data 2014,RSMeans Engineering Department,118.64,RS Means,10/16/2013,575
2708,9780071750240,AIRPORT PLANNING AND MANAGEMENT 6/E,Seth Young,47.87,McGraw-Hill Professional,03/15/2011,608
2709,9780123876935,"Pipeline Rules of Thumb Handbook, Eighth Edition: A Manual of Quick, Accurate Solutions to Everyday Pipeline Engineering Problems",E.W. McAllister,116.86,Gulf Professional Publishing,10/08/2013,806
2710,9781561583584,Understanding Wood: A Craftsman's Guide to Wood Technology,R. Bruce Hoadley,27.24,The Taunton Press,10/01/2000,288
2711,9781619603707,Modern Automotive Technology,James E. Duffy,105.34,Goodheart-Willcox,05/17/2013,1920
2712,9780802715296,Longitude: The True Story of a Lone Genius Who Solved the Greatest Scientific Problem of His Time,Dava Sobel,8.91,Walker & Company,10/30/2007,208
2713,9780760343272,"SR-71: The Complete Illustrated History of the Blackbird, The World's Highest, Fastest Plane",Richard H. Graham,20.94,Zenith Press,05/12/2013,192
2714,9781940238135,RSMeans Mechanical Cost Data 2014,RSMeans Engineering Department,115.63,RS Means,10/04/2013,725
2715,9780143125013,"The Way of the Knife: The CIA, a Secret Army, and a War at the Ends of the Earth",Mark Mazzetti,13.6,Penguin Books,03/25/2014,400
2716,9780840034564,Essentials of Intentional Interviewing: Counseling in a Multicultural World,Kathryn Quirk,106.75,Cengage Learning,05/03/2011,400
2717,9780307720962,Makers: The New Industrial Revolution,Chris Anderson,10.42,Crown Business,04/08/2014,272
