id:INTEGER,ISBN_13,Title,Author,Price:FLOAT,Publisher,Publication_date,Pages:INTEGER
972,9780375702709,A Lesson Before Dying (Oprah's Book Club),Ernest J. Gaines,8.2,Vintage,09/28/1997,256
973,9780789328489,Star Trek 2015 Wall Calendar: Ships of the LIne,Cbs,13.2,Universe Publishing,07/15/2014,24
974,9781476759586,Beautiful Oblivion: A Novel (The Maddox Brothers Series),Jamie McGuire,12.42,Atria Books,07/01/2014,336
975,9780812973990,Let the Great World Spin: A Novel,Colum McCann,9.1,Random House Trade Paperbacks,12/02/2009,375
976,9781848271838,Illusions: The Adventures of a Reluctant Messiah,Richard Bach,9.8,Arrow Books Ltd,03/12/2001,144
977,9781439142011,The Flamethrowers,Rachel Kushner,10.75,Scribner,01/14/2014,416
978,9780345493101,The Dark Defiles (Land Fit for Heroes),Richard K. Morgan,12.55,Del Rey,10/07/2014,656
979,9780399169113,Cut and Thrust (Stone Barrington),Stuart Woods,18.86,Putnam Adult,07/15/2014,320
980,9781250049377,Landline,Rainbow Rowell,15.8,St. Martin's Press,07/08/2014,320
981,9780143104919,Ceremony: (Penguin Classics Deluxe Edition),Leslie Marmon Silko,11.18,Penguin Books,12/26/2006,243
982,9781416516934,"Wolves of the Calla (The Dark Tower, Book 5)",Stephen King,8.99,Pocket Books,01/24/2006,960
983,9780743262170,"Cry, the Beloved Country",Alan Paton,9.75,Scribner,11/01/2003,316
984,9780393913002,"The Norton Anthology of English Literature (Ninth Edition)  (Vol. Package 1: A, B, C)",M. H. Abrams,59.83,W. W. Norton & Company,02/10/2012,3078
985,9781495960239,The Ex Games 1 (Volume 1),J.S. Cooper,5.39,CreateSpace Independent Publishing Platform,02/19/2014,64
986,9781401233020,"Hellblazer, Vol. 2: The Devil You Know",Jaime Delano,12.55,Vertigo,01/03/2012,304
987,9780143124054,A Thousand Mornings: Poems,Mary Oliver,9.04,Penguin Books,09/24/2013,96
988,9780802123244,Cobra,Deon Meyer,18.61,Atlantic Monthly Press,10/07/2014,384
989,9781401688370,A Lady at Willowgrove Hall (Whispers On The Moors),Sarah E. Ladd,10.11,Thomas Nelson,10/07/2014,352
990,9781416521495,"Song of Susannah (The Dark Tower, Book 6)",Stephen King,8.99,Pocket Books,05/23/2006,560
991,9780440245919,A Time to Kill: A Novel,John Grisham,7.23,Dell,06/23/2009,672
992,9780312868857,Hell House,Richard Matheson,9.9,Tor Books,10/13/1999,304
993,9780778316442,The Homecoming (Thunder Point),Robyn Carr,5.78,Harlequin MIRA,08/26/2014,352
994,9780156907392,To the Lighthouse,Virginia Woolf,8.09,Harcourt Brace Jovanovich,12/27/1989,209
995,9780345538192,One Shot (Jack Reacher),Lee Child,8.99,Dell,11/06/2012,485
996,9781617200052,Hinds Feet On High Places,Hannah Hurnard,7.12,Wilder Publications,04/19/2012,132
997,9780415389556,Gender Trouble: Feminism and the Subversion of Identity (Routledge Classics),Judith Butler,19.99,Routledge,05/01/2006,272
998,9780140445688,Capital: Volume 1: A Critique of Political Economy (Penguin Classics),Karl Marx,11.3,Penguin Classics,05/05/1992,1152
999,9780425263921,"Entwined with You (Crossfire, Book 3)",Sylvia Day,9.34,Berkley Trade,06/04/2013,368
1000,9781942002055,Mark - The Callahan Brothers  (Brazos Bend) (Volume 3),Emily March,10.05,Emily March,10/17/2014,300
1001,9780142196816,One Last Thing Before I Go: A Novel,Jonathan Tropper,9.23,Plume,05/28/2013,336
1002,9780226468013,Metaphors We Live By,George Lakoff,9.91,University Of Chicago Press,04/15/2003,256
1003,9780878083909,Perspectives on the World Christian Movement: A Reader (Perspectives),Ralph D. Winter,32.01,William Carey Library,06/13/2013,782
1004,9780811878319,F in Exams: The Very Best Totally Wrong Test Answers,Richard Benson,6.09,Chronicle Books,02/23/2011,128
1005,9780143035008,Anna Karenina,Leo Tolstoy,10.44,Penguin Classics,05/31/2004,864
1006,9780446574754,Mythology: Timeless Tales of Gods and Heroes,Edith Hamilton,9,Grand Central Publishing,01/01/2011,512
1007,9780451210845,The Gunslinger: (The Dark Tower #1)(Revised Edition),Stephen King,6.15,Signet,07/01/2003,336
1008,9780448401249,The Wheels on the Bus (Pudgy Board Book),Jerry Smath,3.59,Grosset & Dunlap,05/02/1991,18
1009,9781455529544,One in a Million (A Lucky Harbor novel),Jill Shalvis,7.2,Grand Central Publishing,10/14/2014,352
1010,9781451678192,The Martian Chronicles,Ray Bradbury,6,Simon & Schuster,04/17/2012,256
1011,9780425260876,Coming Home (An Alex Benedict Novel),Jack McDevitt,16.41,Ace Hardcover,11/04/2014,368
1012,9780451211484,The Confessor (Gabriel Allon Novels),Daniel Silva,8.99,Signet,02/24/2004,480
1013,9781476753164,Maybe Someday,Colleen Hoover,11.56,Atria Books,03/18/2014,384
1014,9780399167348,Five Days Left,Julie Lawson Timmer,17.04,Putnam Adult,09/09/2014,352
1015,9781439193020,Black List: A Thriller,Brad Thor,5.99,Pocket Books,05/21/2013,480
1016,9780452297906,The Keeper of Lost Causes: The First Department Q Novel (A Department Q Novel),Jussi Adler-Olsen,9.04,Plume,07/31/2012,416
1017,9780061350962,Wicked: The Life and Times of the Wicked Witch of the West (Wicked Years),Gregory Maguire,6,Harper,09/25/2007,560
1018,9781616954239,Jane and the Twelve Days of Christmas: Being a Jane Austen Mystery,Stephanie Barron,18.63,Soho Crime,10/28/2014,336
1019,9780764210600,A Matter of Heart (Lone Star Brides) (Volume 3),Tracie Peterson,11.33,Bethany House Publishers,10/07/2014,320
1020,9780425257777,The Legend of Sleepy Harlow (League of Literary Ladies),Kylie Logan,7.19,Berkley,10/07/2014,304
1021,9780140042528,The Dharma Bums,Jack Kerouac,9.28,Penguin Books,05/27/1971,244
1022,9780486419237,The Jungle (Dover Thrift Editions),Upton Sinclair,2.26,Dover Publications,11/09/2001,304
1023,9781451662078,The Secret Diary of Laura Palmer (Twin Peaks),Jennifer Lynch,8.6,Gallery Books,12/06/2011,192
1024,9780804160865,Living Language Dothraki: A Conversational Language Course Based on the Hit Original HBO Series Game of Thrones (Living Language Courses),David J. Peterson,15.59,Living Language,10/07/2014,128
1025,9780802122070,Naked Lunch,Barry Miles,9.05,Grove Press,07/16/2013,304
1026,9780452264014,Fences,August Wilson,8.75,Plume,06/01/1986,101
1027,9780142180358,Mrs. Lincoln's Dressmaker: A Novel,Jennifer Chiaverini,12.23,Plume,09/24/2013,384
1028,9781941235027,Lucky Peach Issue 12: Seashore,Chris Ying,8.64,Lucky Peach,08/19/2014,168
1029,9780553293357,Foundation,Isaac Asimov,6,Bantam Spectra Books,10/01/1991,296
1030,9781599620688,"The Little Big Book for Grandmothers, revised edition",Lena Tabori,16.96,Welcome Books,03/10/2009,352
1031,9780374525743,The Odyssey,D. S. Carne-Ross,8.7,"Farrar, Straus and Giroux",11/05/1998,515
1032,9780399167317,Ghost Ship (The Numa Files),Clive Cussler,21,Putnam Adult,05/27/2014,448
1033,9780807068779,"New and Selected Poems, Volume One",Mary Oliver,13.7,Beacon Press,04/15/2004,272
1034,9780425270837,Lethal Letters (A Books by the Bay Mystery),Ellery Adams,6.86,Berkley,11/04/2014,304
1035,9780061565311,Bel Canto (P.S.),Ann Patchett,9.6,Harper Perennial Modern Classics,06/10/2008,352
1036,9780425265598,Murder in the Mystery Suite (A Book Retreat Mystery),Ellery Adams,5.78,Berkley,08/05/2014,304
1037,9781557427663,The Metamorphosis,Franz Kafka,3.49,Classix Press,09/12/2009,44
1038,9780802144423,Waiting for Godot (Eng rev): A Tragicomedy in Two Acts,Samuel Beckett,8.75,Grove Press,05/17/2011,128
1039,9780544338012,The Silmarillion,J.R.R. Tolkien,11.6,Mariner Books,10/07/2014,384
1040,9781612184128,The Complete Sherlock Holmes (The Heirloom Collection),Arthur Conan Doyle,59.99,Thomas & Mercer,11/13/2012,1884
1041,9781940026015,"The Atlantis Gene: A Thriller (The Origin Mystery, Book 1)",A.G. Riddle,14.25,Modern Mythology,04/05/2013,451
1042,9781250046390,Once We Were Brothers,Ronald H. Balson,9.57,St. Martin's Griffin,10/08/2013,400
1043,9780743499316,Zane's The Other Side of the Pillow: A Novel,Zane,15.96,Atria Books,08/05/2014,288
1044,9781401940584,The Dalai Lama's Cat,David Michie,12.93,Hay House Visions,10/01/2012,240
1045,9780425258064,Stirring the Plot (A Cookbook Nook Mystery),Daryl Wood Gerber,7.19,Berkley,09/30/2014,304
1046,9780743496735,Nineteen Minutes,Jodi Picoult,9.07,Washington Square Press,02/05/2008,455
1047,9781416907527,Raggedy Ann & Andy: A Read-Aloud Treasury,Johnny Gruelle,12.45,Little Simon,11/01/2005,96
1048,9780345325815,The Silmarillion,J.R.R. Tolkien,6,Del Rey,01/12/1985,480
1049,9780062096951,A Tree Grows in Brooklyn: A Novel,Betty Smith,7.82,Harper Perennial,09/16/2014,624
1050,9780743278904,Jonathan Livingston Seagull,Richard Bach,7.84,Scribner,02/07/2006,112
1051,9780062336019,Gutenberg's Apprentice: A Novel,Alix Christie,20.51,Harper,09/23/2014,416
1052,9780525475064,Looking For Alaska,John Green,13.28,Dutton Books,03/03/2005,221
1053,9780345540706,The High Druid's Blade: The Defenders of Shannara,Terry Brooks,19.01,Del Rey,07/08/2014,320
1054,9780374534158,My Struggle: Book 2: A Man in Love,Karl Ove Knausgaard,11.94,"Farrar, Straus and Giroux",06/03/2014,608
1055,9781556594694,Splitting an Order,Ted Kooser,16,Copper Canyon Press,10/21/2014,96
1056,9780345539809,Red Rising: Book I of the Red Rising Trilogy,Pierce Brown,8.86,Del Rey,07/15/2014,416
1057,9780812976533,Midnight's Children: A Novel (Modern Library 100 Best Novels),Salman Rushdie,13.42,Random House Trade Paperbacks,04/04/2006,536
1058,9781416524526,"The Dark Tower (The Dark Tower, Book 7)",Stephen King,8.99,Pocket Books,08/22/2006,1072
1059,9780307950680,The Lost Symbol,Dan Brown,9.86,Anchor,05/01/2012,624
1060,9780140195811,The Gift,Hafiz,14.19,Penguin Compass,08/01/1999,333
1061,9781402278815,What a Lady Needs for Christmas (MacGregor Series),Grace Burrowes,7.19,Sourcebooks Casablanca,10/07/2014,416
1062,9780425261545,Literally Murder (A Black Cat Bookshop Mystery),Ali Brandon,7.19,Berkley,09/30/2014,304
1063,9780394758282,The Big Sleep (Vintage Crime/Black Lizard),Raymond Chandler,8.96,Vintage,07/12/1988,139
1064,9780385333498,The Sirens of Titan: A Novel,Kurt Vonnegut,10.39,Dial Press Trade Paperback,09/08/1998,336
1065,9781495238956,The Adventures of Tom Sawyer,Mark Twain,9.49,CreateSpace Independent Publishing Platform,01/18/2014,272
1066,9781477809785,Terms of Enlistment (Frontlines Book 1),Marko Kloos,10.99,47North,01/28/2014,346
1067,9780758280404,Double Fudge Brownie Murder (A Hannah Swensen Mystery),Joanne Fluke,19.26,Kensington,02/24/2015,304
1068,9780425266250,The Garden of Letters,Alyson Richman,10.12,Berkley Trade,09/02/2014,384
1069,9780449213445,The Chosen,Chaim Potok,7.59,Fawcett,04/12/1987,304
1070,9780316250818,California: A Novel,Edan Lepucki,15.6,"Little, Brown and Company",07/08/2014,400
1071,9781419708848,The Hidden Doors (Explorer),Kazu Kibuishi,8.17,Harry N. Abrams,10/14/2014,128
1072,9781780361901,War God: Nights of the Witch,Graham Hancock,14.1,Peach Publishing,07/31/2013,568
1073,9780765364876,Towers of Midnight (Wheel of Time),Robert Jordan,8.99,Tor Fantasy,10/04/2011,1264
1074,9780061689246,Stardust,Neil Gaiman,6.07,HarperCollins,12/23/2008,288
1075,9780425271582,Jewels of the Sun (Gallaghers of Ardmore Trilogy),Nora Roberts,13.43,Berkley Trade,09/02/2014,368
1076,9780062134707,Remains of Innocence: A Brady Novel of Suspense (Joanna Brady Mysteries),J. A. Jance,17.39,William Morrow,07/22/2014,400
1077,9780393319293,Invisible Monsters: A Novel,Chuck Palahniuk,9.26,W. W. Norton & Company,09/17/1999,304
1078,9780399170867,The Liar,Nora Roberts,20.48,Putnam Adult,04/14/2015,512
1079,9781438002781,"Barron's AP English Literature and Composition, 5th Edition (Barron's Ap English Literture and Composition)",George Ehrenhaft Ed.D.,11.38,Barron's Educational Series,02/01/2014,384
1080,9781455554669,A Life Intercepted: A Novel,Charles Martin,23.4,Center Street,09/02/2014,336
1081,9780140449150,The Prince (Penguin Classics),George Bull,7.6,Penguin Classics,02/04/2003,144
1082,9780451416810,Blowback: A Vanessa Pierson Novel,Valerie Plame,9.91,Signet Select,10/07/2014,400
1083,9780764208997,Keepers of the Covenant (The Restoration Chronicles),Lynn Austin,11.54,Bethany House Publishers,10/07/2014,480
1084,9780515154146,Concealed in Death,J. D. Robb,7.19,Berkley,07/29/2014,384
1085,9780062257840,The Perfume Collector: A Novel,Kathleen Tessaro,9.48,Harper Paperbacks,02/04/2014,464
1086,9781938912481,No Matter the Wreckage,Sarah Kay,11.54,Write Bloody Publishing,03/18/2014,100
1087,9780812980035,Letter to My Daughter,Maya Angelou,9.18,Random House Trade Paperbacks,10/27/2009,192
1088,9781476708690,"The Innovators: How a Group of Hackers, Geniuses, and Geeks Created the Digital Revolution",Walter Isaacson,21,Simon & Schuster,10/07/2014,560
1089,9780545685177,Minecraft: Construction Handbook: An Official Mojang Book,Scholastic,5.81,Scholastic Inc.,09/30/2014,80
1090,9781594632969,How We Got to Now: Six Innovations That Made the Modern World,Steven Johnson,19.55,Riverhead Hardcover,09/30/2014,304
1091,9781455582341,How Google Works,Eric Schmidt,17.99,Grand Central Publishing,09/23/2014,304
1092,9780545685160,Minecraft: Combat Handbook: An Official Mojang Book,Scholastic,6.29,Scholastic Inc.,08/26/2014,80
1093,9781932735659,"PMP Exam Prep, Eighth Edition: Rita's Course in a Book for Passing the PMP Exam",Rita Mulcahy,83.82,RMC Publications,06/12/2013,624
1094,9780984782802,Cracking the Coding Interview: 150 Programming Questions and Solutions,Gayle Laakmann McDowell,30.23,CareerCup,08/22/2011,508
1095,9780545685153,Minecraft: Redstone Handbook: An Official Mojang Book,Scholastic,7.19,Scholastic Inc.,03/25/2014,80
1096,9780545669931,Minecraft: Essential Handbook: An Official Mojang Book,Scholastic,7.19,Scholastic Inc.,11/26/2013,80
1097,9780545427715,Pokemon: Essential Handbook,Scholastic,5.72,Scholastic Inc.,08/01/2012,368
1098,9781616550417,The Legend of Zelda: Hyrule Historia,John Thomas,19.63,Dark Horse Books,01/29/2013,280
1099,9780804162975,Dragon Age Inquisition Collector's Edition: Prima Official Game Guide,David Knight,26.67,Prima Games,11/18/2014,384
1100,9780385347372,Dataclysm: Who We Are (When We Think No One's Looking),Christian Rudder,16.8,Crown,09/09/2014,304
1101,9780071795128,"CompTIA A+ Certification All-in-One Exam Guide, 8th Edition (Exams 220-801 & 220-802)",Michael Meyers,32.1,McGraw-Hill Osborne Media,08/01/2012,1200
1102,9780321934314,The Adobe Photoshop Lightroom 5 Book for Digital Photographers (Voices That Matter),Scott Kelby,38.5,New Riders,07/29/2013,552
1103,9781118531648,JavaScript and JQuery: Interactive Front-End Web Development,Jon Duckett,26.67,Wiley,06/30/2014,640
1104,9781118907443,"Web Design with HTML, CSS, JavaScript and jQuery Set",Jon Duckett,38.69,Wiley,07/08/2014,1152
1105,9781118008188,HTML and CSS: Design and Build Websites,Jon Duckett,17.39,Wiley,11/08/2011,512
1106,9781499772166,Minecraft Books for Kids: The Complete Minecraft Book Series (4 Minecraft Novels for Kids),Brock Netherward,13.94,CreateSpace Independent Publishing Platform,07/01/2014,192
1107,9781101898208,Pokémon Omega Ruby & Pokémon Alpha Sapphire: The Official Hoenn Region Strategy Guide,Pokemon Company International,13.19,The Pokémon Company International,11/21/2014,480
1108,9781441303257,The Personal Internet Address & Password Log Book,Peter Pauper Press,6.8,Peter Pauper Press,07/04/2010,144
1109,9780321965516,"Don't Make Me Think, Revisited: A Common Sense Approach to Web Usability (3rd Edition) (Voices That Matter)",Steve Krug,30.02,New Riders,01/03/2014,216
1110,9781494932633,The Hacker Playbook: Practical Guide To Penetration Testing,Peter Kim,21.93,CreateSpace Independent Publishing Platform,03/13/2014,294
1111,9781449355739,"Learning Python, 5th Edition",Mark Lutz,40.89,O'Reilly Media,07/06/2013,1600
1112,9781494295509,Rtfm: Red Team Field Manual,Ben Clark,9,CreateSpace Independent Publishing Platform,02/11/2014,96
1113,9781500734756,Blue Team Handbook: Incident Response Edition: A condensed field guide for the Cyber Security Incident Responder.,Don Murdoch GSE,13.19,CreateSpace Independent Publishing Platform,08/03/2014,154
1114,9781118821077,Windows 8.1 For Dummies Book + DVD Bundle,Andy Rathbone,16.77,For Dummies,10/28/2013,432
1115,9781491947166,OS X Yosemite: The Missing Manual,David Pogue,23.92,O'Reilly Media,12/20/2014,900
1116,9781101898154,Hyrule Warriors: Prima Official Game Guide (Prima Official Game Guides),Prima Games,26.06,Prima Games,09/26/2014,272
1117,9781118289174,PHR / SPHR: Professional in Human Resources Certification Study Guide,Sandra M. Reed,32.04,Sybex,05/08/2012,648
1118,9780988263406,Tony Northrup's DSLR Book: How to Create Stunning Digital Photography,Tony Northrup,19.86,Mason Press,12/01/2012,241
1119,9781476761084,Winners Dream: A Journey from Corner Store to Corner Office,Bill McDermott,19.77,Simon & Schuster,10/14/2014,336
1120,9781502305664,"Minecraft: Book of House Design: Gorgeous Book of Minecraft House Designs. Interior & Exterior. All-In-One Catalog with Step-by-Step Guides. Mansions, High-Tech Construction and House Ideas.",Minecraft Books,5.39,CreateSpace Independent Publishing Platform,09/08/2014,92
1121,9781451648539,Steve Jobs,Walter Isaacson,19.65,Simon & Schuster,10/24/2011,656
1122,9780062273062,"Jab, Jab, Jab, Right Hook: How to Tell Your Story in a Noisy Social World",Gary Vaynerchuk,16.12,HarperBusiness,11/26/2013,224
1123,9781402295614,Spam Nation: The Inside Story of Organized Cybercrime-from Global Epidemic to Your Front Door,Brian Krebs,15.8,Sourcebooks,11/18/2014,256
1124,9780071789226,CompTIA Network+ All-In-One Exam Guide: Exam N10-005,Mike Meyers,31.64,Mcgraw-Hill Osborne Media,01/09/2012,791
1125,9781118490365,Excel 2013 Bible,John Walkenbach,28.99,Wiley,03/04/2013,1056
1126,9780393239355,"The Second Machine Age: Work, Progress, and Prosperity in a Time of Brilliant Technologies",Erik Brynjolfsson,15.66,W. W. Norton & Company,01/20/2014,320
1127,9780262033848,"Introduction to Algorithms, 3rd Edition",Thomas H. Cormen,79.13,The MIT Press,07/31/2009,1312
1128,9781449319793,"Python for Data Analysis: Data Wrangling with Pandas, NumPy, and IPython",Wes McKinney,25.24,O'Reilly Media,10/29/2012,470
1129,9781101898093,Bayonetta 2: Prima Official Game Guide,Geson Hatchett,25.4,Prima Games,10/24/2014,288
1130,9780071772006,OCA/OCP Java SE 7 Programmer I & II Study Guide (Exams 1Z0-803 & 1Z0-804) (Certification Press),Kathy Sierra,40.57,McGraw-Hill Osborne Media,10/24/2014,888
1131,9780071781749,CISSP All-In-One Exam Guide [With CDROM],Shon Harris,42.18,McGraw-Hill/Osborne Media,10/18/2012,1430
1132,9780744015584,Skylanders Trap Team Signature Series Strategy Guide (Bradygames Signature Guides),BradyGames,16.67,BRADY GAMES,10/05/2014,256
1133,9780744015638,Destiny Limited Edition Strategy Guide,BradyGames,26.53,BRADY GAMES,09/09/2014,400
1134,9780131103627,"The C Programming Language, 2nd Edition",Brian W. Kernighan,48.99,Prentice Hall,04/01/1988,274
1135,9780545646024,Pokemon: Kalos Region Handbook (Pokémon),Scholastic Editorial,8.45,Scholastic Inc.,07/29/2014,128
1136,9780596153748,Make: Electronics (Learning by Discovery),Charles Platt,19.34,Make,12/20/2009,352
1137,9781449341756,QuickBooks 2014: The Missing Manual: The Official Intuit Guide to QuickBooks 2014,Bonnie Biafore,29.69,O'Reilly Media,11/07/2013,810
1138,9781593275327,The LEGO MINDSTORMS EV3 Discovery Book (Full Color): A Beginner's Guide to Building and Programming Robots,Laurens Valk,22.1,No Starch Press,05/26/2014,396
1139,9780452295834,"How to Survive the End of the World as We Know It: Tactics, Techniques, and Technologies for Uncertain Times",James Wesley Rawles,11.9,Plume,09/30/2009,336
1140,9781479274833,Elements of Programming Interviews: The Insiders' Guide,Adnan Aziz,35.96,CreateSpace Independent Publishing Platform,10/11/2012,502
1141,9780976339601,Traction: A Startup Guide to Getting Customers,Gabriel Weinberg,11.93,S-curves Publishing,08/25/2014,258
1142,9780596009205,"Head First Java, 2nd Edition",Kathy Sierra,28.95,O'Reilly Media,02/09/2005,688
1143,9780199678112,"Superintelligence: Paths, Dangers, Strategies",Nick Bostrom,21.6,Oxford University Press,09/03/2014,352
1144,9780744015683,Borderlands: The Pre-Sequel Signature Series Strategy Guide,BradyGames,16.41,BRADY GAMES,10/14/2014,400
1145,9780132350884,Clean Code: A Handbook of Agile Software Craftsmanship,Robert C. Martin,38.82,Prentice Hall,08/11/2008,464
1146,9780672336072,Sams Teach Yourself SQL in 10 Minutes (4th Edition),Ben Forta,19.82,Sams Publishing,11/04/2012,288
1147,9781593273897,The Linux Command Line: A Complete Introduction,William E. Shotts Jr.,22.57,No Starch Press,01/17/2012,480
1148,9781449361327,Data Science for Business: What you need to know about data mining and data-analytic thinking,Foster Provost,31.89,O'Reilly Media,08/19/2013,414
1149,9781413320732,Quicken WillMaker Plus 2015 Edition: Book & Software Kit,Editors of Nolo,32.23,NOLO,10/31/2014,472
1150,9781118289426,Mastering Windows Server 2012 R2,Mark Minasi,38.5,Sybex,12/23/2013,1670
1151,9780201633610,Design Patterns: Elements of Reusable Object-Oriented Software,Erich Gamma,47.12,Addison-Wesley Professional,11/10/1994,395
1152,9781461471370,An Introduction to Statistical Learning: with Applications in R (Springer Texts in Statistics),Gareth James,75.99,Springer,08/12/2013,426
1153,9780137043293,Essential Scrum: A Practical Guide to the Most Popular Agile Process (Addison-Wesley Signature Series (Cohn)),Kenneth S. Rubin,33.05,Addison-Wesley Professional,08/05/2012,504
1154,9780307895509,Elder Scrolls V: Skyrim Legendary Standard Edition: Prima Official Game Guide (Prima Official Game Guides),David Hodgson,18.26,Prima Games,06/04/2013,1120
1155,9781118875070,CompTIA Security+ Study Guide: SY0-401,Chuck Easttom,33.09,Sybex,05/05/2014,552
1156,9780393240764,The Glass Cage: Automation and Us,Nicholas Carr,19.86,W. W. Norton & Company,09/29/2014,288
1157,9781118749616,"CCNA Routing and Switching Study Guide: Exams 100-101, 200-101, and 200-120",Todd Lammle,41.23,Sybex,10/07/2013,1176
1158,9781587143878,CCNA Routing and Switching 200-120 Official Cert Guide Library,Wendell Odom,39.53,Cisco Press,06/02/2013,1600
1159,9781285166025,Microsoft Office 2013: Introductory (Shelly Cashman),Misty E. Vermaat,171.99,Cengage Learning,05/31/2013,1200
1160,9781617291081,Learn Windows PowerShell 3 in a Month of Lunches,Don Jones,28.1,Manning Publications,11/25/2012,368
1161,9781630470173,"Launch: An Internet Millionaire's Secret Formula To Sell Almost Anything Online, Build A Business You Love, And Live The Life Of Your Dreams",Jeff Walker,10.64,Morgan James Publishing,06/24/2014,206
1162,9781587143854,CCENT/CCNA ICND1 100-101 Official Cert Guide,Wendell Odom,26.35,Cisco Press,05/05/2013,900
1163,9781118661147,Mastering VMware vSphere 5.5,Scott Lowe,35.68,Sybex,11/04/2013,840
1164,9781627790734,"No Place to Hide: Edward Snowden, the NSA, and the U.S. Surveillance State",Glenn Greenwald,16.17,Metropolitan Books,05/13/2014,272
1165,9780735666054,Training Kit (Exam 70-461) Querying Microsoft SQL Server 2012 (MCSA) (Microsoft Press Training Kit),Itzik Ben-Gan,48.69,Microsoft Press,12/25/2012,752
1166,9781430264484,Pro AngularJS (Expert's Voice in Web Development),Adam Freeman,36.27,Apress,03/25/2014,688
1167,9780465026562,"Gödel, Escher, Bach: An Eternal Golden Braid",Douglas R. Hofstadter,14.48,Basic Books,02/05/1999,824
1168,9781118821213,Windows 8.1 For Dummies,Andy Rathbone,14.97,For Dummies,10/07/2013,432
1169,9780988262508,"The Phoenix Project: A Novel about IT, DevOps, and Helping Your Business Win",Gene Kim,15.69,IT Revolution Press,10/16/2014,376
1170,9781590282410,"Python Programming: An Introduction to Computer Science, 2nd Ed.",John Zelle,19.99,"Franklin, Beedle & Associates Inc.",05/20/2010,432
1171,9780321563842,"The C++ Programming Language, 4th Edition",Bjarne Stroustrup,48.38,Addison-Wesley Professional,05/19/2013,1368
1172,9780201616224,The Pragmatic Programmer: From Journeyman to Master,Andrew Hunt,34.32,Addison-Wesley Professional,10/30/1999,352
1173,9780321804334,Android Programming: The Big Nerd Ranch Guide (Big Nerd Ranch Guides),Bill Phillips,28.99,Big Nerd Ranch Guides,04/07/2013,580
1174,9780321888037,R for Everyone: Advanced Analytics and Graphics (Addison-Wesley Data & Analytics Series),Jared Lander,26.53,Addison-Wesley Professional,12/29/2013,464
1175,9781449364915,Head First PMP,Jennifer Greene,42.52,O'Reilly Media,12/29/2013,894
1176,9781441308146,The Personal Internet Address & Password Logbook (Red),Peter Pauper Press,6,Peter Pauper Press,02/25/2012,144
1177,9780321356680,Effective Java (2nd Edition),Joshua Bloch,38.91,Addison-Wesley,05/28/2008,346
1178,9780071793087,"CISSP Boxed Set, Second Edition (All-in-One)",Shon Harris,61.79,McGraw-Hill Osborne Media,01/25/2013,1488
1179,9781568989693,"Thinking with Type, 2nd revised and expanded edition: A Critical Guide for Designers, Writers, Editors, & Students",Ellen Lupton,14.05,Princeton Architectural Press,10/06/2010,224
1180,9781616554774,The Art of Naughty Dog,Naughty Dog Studios,25.18,Dark Horse Books,10/14/2014,184
1181,9781612903439,"The Little SAS Book: A Primer, Fifth Edition",Lora Delwiche,46.3,SAS Institute,11/07/2012,350
1182,9780387848570,"The Elements of Statistical Learning: Data Mining, Inference, and Prediction, Second Edition (Springer Series in Statistics)",Jerome Friedman,84.04,Springer,04/12/2011,745
1183,9781446249185,Discovering Statistics using IBM SPSS Statistics,Andy Field,77.52,SAGE Publications Ltd,01/24/2013,952
1184,9780321714114,C++ Primer (5th Edition),Stanley B. Lippman,41.93,Addison-Wesley Professional,08/16/2012,976
1185,9781449344214,Getting Started with Raspberry Pi (Make: Projects),Matt Richardson,11.59,"Maker Media, Inc",01/03/2013,176
1186,9780071809252,Java: A Beginner's Guide,Herbert Schildt,26.48,Mcgraw-Hill Osborne Media,04/15/2014,699
1187,9781938377006,Information Dashboard Design: Displaying Data for At-a-Glance Monitoring,Stephen Few,26.3,Analytics Press,08/15/2013,260
