id:INTEGER,ISBN_13,Title,Author,Price:FLOAT,Publisher,Publication_date,Pages:INTEGER
1760,9780596520830,Learning SQL,Alan Beaulieu,23.98,O'Reilly Media,04/30/2009,338
1761,9780321503626,"Growing Object-Oriented Software, Guided by Tests",Steve Freeman,42.69,Addison-Wesley Professional,10/22/2009,384
1762,9781500164614,Minecraft Expert: Minecraft Kids Joke Book,Minecraft Jokes TM,6.29,CreateSpace Independent Publishing Platform,06/12/2014,42
1763,9781484867570,Ad Serving Technology: Understand the marketing revelation that commercialized the Internet,Gregory Cristal,25.19,CreateSpace Independent Publishing Platform,01/04/2014,596
1764,9781118289402,"Group Policy: Fundamentals, Security, and the Managed Desktop",Jeremy Moskowitz,33.52,Sybex,01/04/2013,912
1765,9780470408810,"The Science Teacher's Activity-A-Day, Grades 5-10: Over 180 Reproducible Pages of Quick, Fun Projects that Illustrate Basic Concepts",Pam Walker,14.63,Jossey-Bass,10/05/2010,288
1766,9780071771474,"CompTIA Security + All-in-One Exam Guide (Exam SY0-301), 3rd Edition with CD-ROM",Chuck Cothren,30.57,Mcgraw-Hill Osborne Media,07/19/2011,665
1767,9781452107202,"Blog, Inc.: Blogging for Passion, Profit, and to Create Community",Joy Deangdeelert Cho,11.41,Chronicle Books,09/19/2012,184
1768,9781305109919,Beginning C++ Through Game Programming,Michael Dawson,25.2,Cengage Learning PTR,06/23/2014,416
1769,9781935182399,R in Action,Robert Kabacoff,36.99,Manning Publications,08/27/2011,472
1770,9780804162982,The Witcher 3: Wild Hunt Collector's Edition: Prima Official Game Guide,David Hodgson,29.99,Prima Games,02/24/2015,448
1771,9780804162869,Lightning Returns: Final Fantasy XIII: The Complete Official Guide - Collector's Edition,Piggyback,28.7,Piggyback,02/11/2014,352
1772,9781416596585,"In The Plex: How Google Thinks, Works, and Shapes Our Lives",Steven Levy,15,Simon & Schuster,04/12/2011,432
1773,9780071780285,Hacking Exposed 7: Network Security Secrets &Amp; Solutions (Hacking Exposed: Network Security Secrets & Solutions),George Kurtz,31.96,McGraw-Hill Osborne Media,07/11/2012,768
1774,9780143124047,How to Create a Mind: The Secret of Human Thought Revealed,Ray Kurzweil,10.24,Penguin Books,08/27/2013,352
1775,9780133769395,Starting Out with C++ from Control Structures to Objects (8th Edition),Tony Gaddis,135.48,Addison-Wesley,03/08/2014,1280
1776,9781937538583,Photoshop CC and Lightroom: A Photographer's Handbook,Stephen Laskevitch,28.87,Rocky Nook,09/20/2014,344
1777,9781449313876,Arduino Cookbook,Michael Margolis,26.87,O'Reilly Media,12/30/2011,724
1778,9780975568613,The Visible Ops Handbook: Implementing ITIL in 4 Practical and Auditable Steps,Kevin Behr,18.01,Information Technology Process Institute,06/15/2005,112
1779,9780062082435,The Big Disconnect: Protecting Childhood and Family Relationships in the Digital Age,EdD. Steiner-Adair Catherine,11.85,Harper Paperbacks,08/12/2014,384
1780,9780133024449,E-Commerce 2014 (10th Edition),Ken Laudon,209,Prentice Hall,12/01/2013,912
1781,9789187445095,"Deployment Fundamentals, Vol. 5: Building a Real-World Infrastructure with Windows Server 2012 R2, Mdt 2013, and Powershell",Johan Arwidmark,37.95,Deployment Artist,09/09/2014,260
1782,9781250010452,"How to Be Invisible: Protect Your Home, Your Children, Your Assets, and Your Life",J. J. Luna,14.78,Thomas Dunne Books,07/17/2012,320
1783,9781449361594,High Performance Python: Practical Performant Programming for Humans,Ian Ozsvald,25.18,O'Reilly Media,09/20/2014,370
1784,9780789752239,The Ultimate Player's Guide to Minecraft,Stephen O'Brien,18.45,Que Publishing,10/30/2013,320
1785,9780735674387,Training Guide Programming in HTML5 with JavaScript and CSS3 (MCSD) (Microsoft Press Training Guide),Glenn Johnson,38.09,Microsoft Press,03/25/2013,688
1786,9781449314286,"High Performance MySQL: Optimization, Backups, and Replication",Baron Schwartz,31.8,O'Reilly Media,04/02/2012,828
1787,9781937538606,Mastering the Nikon D810,Darrell Young,28.03,Rocky Nook,12/17/2014,576
1788,9780321579362,Succeeding with Agile: Software Development Using Scrum,Mike Cohn,35.99,Addison-Wesley Professional,11/05/2009,504
1789,9781494820602,Unlock the Power of Your Chromecast,Aaron Halbert,10.73,CreateSpace Independent Publishing Platform,12/27/2013,48
1790,9780470509463,Windows 7 For Seniors For Dummies,Mark Justice Hinton,17.73,For Dummies,08/28/2009,408
1791,9781449320027,"Active Directory: Designing, Deploying, and Running Active Directory",Brian Desmond,37.16,O'Reilly Media,05/31/2013,738
1792,9780387981406,ggplot2: Elegant Graphics for Data Analysis (Use R!),Hadley Wickham,55.4,Springer,08/07/2009,213
1793,9780471117094,"Applied Cryptography: Protocols, Algorithms, and Source Code in C",Bruce Schneier,37.95,Wiley,10/18/1996,758
1794,9780735648739,"Windows Internals, Part 1 (6th Edition) (Developer Reference)",Alex Ionescu,23.12,Microsoft Press,03/25/2012,752
1795,9781500446581,Minecraft: ADVANCED Building Guide: Learn to Create AMAZING Expert Level Designs!,Minecraft Books,6.27,CreateSpace Independent Publishing Platform,07/09/2014,54
1796,9781587133169,Introduction to Networks Companion Guide,Cisco Networking Academy,53.76,Cisco Press,12/30/2013,720
1797,9781890774660,Murach's HTML5 and CSS3,Zak Ruvalcaba,34.1,Mike Murach & Associates,12/23/2011,656
1798,9781496126702,Chromecast: A Step by Step User Guide for Beginners,James J Burton,6.29,CreateSpace Independent Publishing Platform,03/04/2014,50
1799,9781594205651,Social Physics: How Good Ideas SpreadThe Lessons from a New Science,Alex Pentland,20.48,"Penguin Press HC, The",01/30/2014,320
1800,9781593275648,Penetration Testing: A Hands-On Introduction to Hacking,Georgia Weidman,31.07,No Starch Press,06/08/2014,528
1801,9780071816786,Tableau 8: The Official Guide,George Peck,23.29,McGraw-Hill Osborne Media,08/20/2013,230
1802,9780983364726,Total Workday Control Using Microsoft®  Outlook,Michael Linenberger,13.56,New Academy Publishers,10/08/2013,398
1803,9781430218333,Pro Git,Scott Chacon,24.11,Apress,08/26/2009,288
1804,9780321842688,Hacker's Delight (2nd Edition),Henry S. Warren,45.99,Addison-Wesley Professional,10/05/2012,512
1805,9781118991190,OS X Yosemite For Dummies (For Dummies (Computer/Tech)),Bob LeVitus,21.27,For Dummies,11/03/2014,512
1806,9780133807806,Java How To Program (Early Objects) (10th Edition),Paul Deitel,138.49,Prentice Hall,03/06/2014,1248
1807,9780471729983,Geo-Business: GIS in the Digital Organization,James B. Pick,92.22,Wiley,01/02/2008,416
1808,9781936220915,"Microsoft Outlook 2013 Mail, Calendar, People, Tasks Quick Reference (Cheat Sheet of Instructions, Tips & Shortcuts - Laminated Guide)",Beezix Inc.,5.18,Beezix Inc.,05/06/2013,4
1809,9780735627086,Self-Paced Training Kit (Exam 70-680) Configuring Windows 7 (MCTS) (Microsoft Press Training Kit),Ian McLean,42.52,Microsoft Press,10/31/2009,912
1810,9781632204400,Minecraft Hacks: The Unofficial Guide to Tips and Tricks That Other Guides Wont Teach You,Megan Miller,11.61,Sky Pony Press,08/12/2014,160
1811,9781465419231,WWE 50,Kevin Sullivan,19.32,BRADY GAMES,03/31/2014,208
1812,9780071792349,"CISSP Practice Exams, Second Edition",Shon Harris,24.38,McGraw-Hill Osborne Media,10/30/2012,480
1813,9781305093911,CompTIA Security+ Guide to Network Security Fundamentals,Mark Ciampa,155.81,Cengage Learning,08/05/2014,720
1814,9780989151146,The Invent To Learn Guide to 3D Printing in the Classroom: Recipes for Success,Gary S. Stager,19.38,Constructing Modern Knowledge Press,06/01/2014,178
1815,9780547554839,The Best American Short Stories 2013,Elizabeth Strout,12.18,Mariner Books,10/08/2013,384
1816,9780321657299,Rocket Surgery Made Easy: The Do-It-Yourself Guide to Finding and Fixing Usability Problems,Steve Krug,23.9,New Riders,12/18/2009,168
1817,9781118791783,Facebook All-in-One For Dummies (For Dummies (Computer/Tech)),Jamie Crager,20.31,For Dummies,04/28/2014,528
1818,9780789732606,Life and Health Insurance License Exam Cram,Bisys Educational Services,35.61,Pearson IT Certification,12/13/2004,600
1819,9781118789704,"CCNA Routing and Switching Deluxe Study Guide: Exams 100-101, 200-101, and 200-120",Todd Lammle,61.83,Sybex,12/23/2013,1184
1820,9781909253063,Learn Excel 2013 Essential Skills with The Smart Method: Courseware tutorial for self-instruction to beginner and intermediate level,Mike Smart,11.99,The Smart Method Ltd,12/17/2013,362
1821,9780133571783,Web Development and Design Foundations with HTML5 (7th Edition),Terry Felke-Morris,91.45,Addison-Wesley,02/24/2014,704
1822,9780804137508,Remote: Office Not Required,Jason Fried,14.55,Crown Business,10/29/2013,256
1823,9780073376882,Introduction to Information Systems - Loose Leaf,George Marakas,163.02,McGraw-Hill/Irwin,01/19/2012,768
1824,9781934217856,"Theology of the Body for Beginners: A Basic Introduction to Pope John Paul II's Sexual Revolution, Revised Edition",Christopher West,11.69,Ascension Press,09/01/2009,174
1825,9781467549400,"Red Hat Certified System Administrator & Engineer: Training Guide and a Quick Deskside Reference, Exams EX200 & EX300",Asghar Ghori,38.64,Endeavor Technologies Inc.,12/20/2012,640
1826,9780073376905,Business Driven Technology,Paige Baltzan,263.14,McGraw-Hill/Irwin,01/16/2014,624
1827,9780321928481,Adobe Photoshop Lightroom 5: Classroom in a Book,Adobe Creative Team,38.72,Adobe Press,08/23/2013,416
1828,9781593275099,The Practice of Network Security Monitoring: Understanding Incident Detection and Response,Richard Bejtlich,31.24,No Starch Press,08/05/2013,376
1829,9780321125217,Domain-Driven Design: Tackling Complexity in the Heart of Software,Eric Evans,56.41,Addison-Wesley Professional,08/30/2003,560
1830,9780133056228,"Technology In Action, Complete (10th Edition)",Mary Anne Poatsy,134.68,Prentice Hall,01/13/2013,656
1831,9780979958717,Nmap Network Scanning: The Official Nmap Project Guide to Network Discovery and Security Scanning,Gordon Fyodor Lyon,30.71,Nmap Project,01/01/2009,464
1832,9780672336225,Windows Server 2012 Unleashed,Rand Morimoto,36.44,Sams Publishing,09/26/2012,1680
1833,9780321926975,Adobe InDesign CC Classroom in a Book (Classroom in a Book (Adobe)),Adobe Creative Team,38.72,Adobe Press,07/13/2013,432
1834,9781455584291,"In Real Life: Love, Lies & Identity in the Digital Age",Nev Schulman,14.4,Grand Central Publishing,09/02/2014,256
1835,9781484201107,ASP.NET Web API 2: Building a REST Service from Start to Finish,Jamie Kurtz,23.96,Apress,07/27/2014,280
1836,9780060007737,The 22 Immutable Laws of Branding,Al Ries,12.01,HarperBusiness,09/17/2002,272
1837,9781617290572,Node.js in Action,Mike Cantelon,30.21,Manning Publications,11/28/2013,416
1838,9781617291418,The Joy of Clojure,Michael Fogus,40.16,Manning Publications,06/13/2014,520
1839,9781462113897,Journey to the Veil,John Pontius,15.36,Cedar Fort,11/12/2013,288
1840,9780744014952,Grand Theft Auto V Limited Edition Strategy Guide (Bradygames Strategy Guides),Tim Bogenn,12.53,BRADY GAMES,09/17/2013,448
1841,9780133761313,"Intro to Java Programming, Comprehensive Version (10th Edition)",Y. Daniel Liang,126.29,Prentice Hall,01/06/2014,1344
1842,9780321928832,HTML and CSS: Visual QuickStart Guide (8th Edition),Elizabeth Castro,24.29,Peachpit Press,08/19/2013,576
1843,9781937785444,3D Game Programming for Kids: Create Interactive Worlds with JavaScript (Pragmatic Programmers),Chris Strom,23.16,Pragmatic Bookshelf,10/26/2013,250
1844,9781482216639,"The Complete Guide to Blender Graphics, Second Edition: Computer Modeling and Animation",John M. Blain,54.96,A K Peters/CRC Press,06/17/2014,575
1845,9780262028134,Category Theory for the Sciences,David I. Spivak,47.5,The MIT Press,10/10/2014,496
1846,9780804162555,Madden NFL 15: Prima Official Game Guide,Gamer Media Inc,9.47,Prima Games,08/26/2014,224
1847,9781118729168,"Effective Project Management: Traditional, Agile, Extreme",Robert K. Wysocki,53.92,Wiley,12/16/2013,768
1848,9781118204979,Nikon D3300 For Dummies,Julie Adair King,23.96,For Dummies,05/19/2014,320
1849,9781585038534,SolidWorks 2014 Part I - Basic Tools,Paul Tran,67.5,SDC Publications,01/02/2014,724
1850,9781937965044,Scrum: a Breathtakingly Brief and Agile Introduction,Chris Sims,8.96,Dymaxicon,04/03/2012,54
1851,9781743331361,Itil® Foundation Complete Certification Kit - Study Book and eLearning Program - 4th edition,Ivanka Menken,99.97,Emereo Pty Ltd,09/12/2011,392
1852,9781849511261,Python 3 Object Oriented Programming,Dusty Phillips,47.49,Packt Publishing,07/26/2010,404
1853,9781118768068,Teach Yourself VISUALLY iMac (Teach Yourself VISUALLY (Tech)),Guy Hart-Davis,19.57,Visual,05/05/2014,384
1854,9780321344755,"Don't Make Me Think: A Common Sense Approach to Web Usability, 2nd Edition",Steve Krug,24.27,New Riders,08/28/2005,216
1855,9789059053601,Mac OS X Yosemite for Seniors: Learn Step by Step How to Work with Mac OS X Yosemite (Computer Books for Seniors series),Studio Visual Steps,17.34,Visual Steps Publishing,09/01/2014,296
1856,9781491947074,JavaScript & jQuery: The Missing Manual,David Sawyer McFarland,29.5,O'Reilly Media,10/03/2014,686
1857,9781572229167,Sql Guide (Quickstudy: Computer),Inc. BarCharts,4.95,QuickStudy,01/01/2005,4
1858,9781118645215,Lightroom 5: Streamlining Your Digital Photography Process,Nat Coalson,28.58,Wiley,07/29/2013,512
1859,9780814743508,Spreadable Media: Creating Value and Meaning in a Networked Culture (Postmillennial Pop),Henry Jenkins,21.04,NYU Press,01/21/2013,352
1860,9780321498052,Introduction to Programming in Java: An Interdisciplinary Approach,Robert Sedgewick,76.6,Addison-Wesley,07/27/2007,736
1861,9781612194080,Ada's Algorithm: How Lord Byron's Daughter Ada Lovelace Launched the Digital Age,James Essinger,19.23,Melville House,10/14/2014,272
1862,9780596009762,SQL Cookbook (Cookbooks (O'Reilly)),Anthony Molinaro,23.1,O'Reilly Media,12/23/2005,636
1863,9781932925630,QuickBooks Online: The Ultimate Guide to All Online Plans,Thomas E. Barich,24.75,CPA911 PUBLISHING,07/01/2014,352
1864,9780789753496,My Samsung Galaxy S5,Steve Schwartz,15.24,Que Publishing,07/24/2014,656
1865,9780538746311,Spreadsheet Modeling & Decision Analysis: A Practical Introduction to Management Science (with Essential Resources Printed Access Card),Cliff Ragsdale,285.75,Cengage Learning,12/06/2010,792
1866,9781118497159,Office 2013 For Dummies,Wallace Wang,15.92,For Dummies,03/04/2013,432
1867,9781624650147,The Art of Paperblue,Jae-Cheol Park,25.27,Design Studio Press,11/15/2014,192
1868,9780735677227,Exam Ref 70-486 Developing ASP.NET MVC 4 Web Applications (MCSD),William Penberthy,24.6,Microsoft Press,09/25/2013,384
1869,9781118859131,Professional Microsoft SQL Server 2014 Administration,Adam Jorgensen,33.8,Wrox,09/09/2014,936
1870,9781285081953,Java Programming,Joyce Farrell,142.71,Cengage Learning,01/31/2013,1120
1871,9780131872486,Thinking in Java (4th Edition),Bruce Eckel,41.73,Prentice Hall,02/20/2006,1150
1872,9780071834261,"CompTIA Security+ Certification Bundle, Second Edition (Exam SY0-401) (Certification Press)",Glen E. Clarke,44.03,McGraw-Hill Osborne Media,08/22/2014,1322
1873,9781615470211,PowerPivot Alchemy: Patterns and Techniques for Excel,Rob Collie,18.53,Holy Macro! Books,06/17/2014,223
1874,9780961392178,Beautiful Evidence,Edward R. Tufte,39.49,Graphics Pr,July 2006,213
1875,9780133360905,Building Java Programs (3rd Edition),Stuart Reges,129.05,Addison-Wesley,03/07/2013,1176
1876,9780321822437,Adobe After Effects CS6 Classroom in a Book,Adobe Creative Team,38.44,Adobe Press,06/25/2012,416
1877,9781284031621,Fundamentals Of Information Systems Security (Jones & Bartlett Learning Information Systems Security & Assurance),David Kim,94.95,Jones & Bartlett Learning,07/11/2013,544
1878,9781118921173,Facebook and Twitter For Seniors For Dummies (For Dummies (Computer/Tech)),Marsha Collier,17.27,For Dummies,08/18/2014,360
1879,9781118862858,Mastering Autodesk Revit Architecture 2015: Autodesk Official Press,Eddy Krygiel,53.21,Sybex,06/03/2014,992
1880,9781118590829,Digital SLR Photography All-in-One For Dummies,Robert Correll,28.5,For Dummies,05/28/2013,672
1881,9780486417097,"An Introduction to Information Theory: Symbols, Signals and Noise (Dover Books on Mathematics)",John R. Pierce,3.99,Dover Publications,11/01/1980,336
1882,9781118168448,Advanced Web Metrics with Google Analytics,Brian Clifton,26.1,Sybex,04/03/2012,600
1883,9780321803023,How Google Tests Software,James A. Whittaker,28.17,Addison-Wesley Professional,04/02/2012,320
1884,9781890774714,Murach's Android Programming,Joel Murach,43.16,Mike Murach & Associates,09/23/2013,702
1885,9780131988422,Discrete-Time Signal Processing (3rd Edition) (Prentice Hall Signal Processing),Alan V. Oppenheim,190.73,Prentice Hall,08/28/2009,1120
1886,9780735681019,Microsoft Excel 2013 Step By Step,Curtis Frye,19.81,Microsoft Press,04/10/2014,512
1887,9781118872147,Nikon D5300 For Dummies,Julie Adair King,18.95,For Dummies,03/10/2014,352
1888,9780321933164,"Introduction to Game Design, Prototyping, and Development: From Concept to Playable Game with Unity and C#",Jeremy Gibson,57.75,Addison-Wesley Professional,07/21/2014,944
1889,9781491947326,"iMovie: The Missing Manual: 2014 release, covers iMovie 10.0 for Mac and 2.0 for iOS (Missing Manuals)",David Pogue,24.29,O'Reilly Media,06/02/2014,432
1890,9781446256565,Qualitative Data Analysis with NVivo,Patricia Bazeley,49.4,SAGE Publications Ltd,04/25/2013,328
1891,9780672336973,WPF 4.5 Unleashed,Adam Nathan,36.56,Sams Publishing,08/09/2013,864
1892,9781617290558,PowerShell in Depth: An administrator's guide,Don Jones,30.54,Manning Publications,03/03/2013,632
1893,9780385337311,What Your Fifth Grader Needs to Know: Fundamentals of a Good Fifth-Grade Education (Core Knowledge Series),E.D. Hirsch Jr.,13.73,Delta,06/27/2006,384
1894,9780735665873,"Windows Internals, Part 2 (6th Edition) (Developer Reference)",Alex Ionescu,26.94,Microsoft Press,09/25/2012,672
1895,9780321776419,Programming in C (4th Edition) (Developer's Library),Stephen G. Kochan,41.23,Addison-Wesley Professional,08/28/2014,600
1896,9780470903711,Office 2011 for Mac All-in-One For Dummies,Geetesh Bajaj,21.21,For Dummies,03/15/2011,840
1897,9781617291029,Solr in Action,Trey Grainger,42.79,Manning Publications,04/05/2014,664
1898,9780984521401,Kanban: Successful Evolutionary Change for Your Technology Business,David J. Anderson,39.71,Blue Hole Press,04/07/2010,278
1899,9781593275402,The Principles of Object-Oriented JavaScript,Nicholas C. Zakas,16.64,No Starch Press,02/23/2014,120
1900,9780138147570,Signals and Systems (2nd Edition),Alan V. Oppenheim,177.92,Prentice Hall,08/16/1996,957
1901,9780670025602,More Awesome Than Money: Four Boys and Their Heroic Quest to Save Your Privacy from Facebook,Jim Dwyer,20.93,Viking Adult,10/16/2014,384
1902,9780071819978,OCP Upgrade to Oracle Database 12c Exam Guide (Exam 1Z0-060) (Oracle Press),Sam R. Alapati,43.72,McGraw-Hill Osborne Media,05/13/2014,528
1903,9781285776712,"Programming Logic and Design, Comprehensive",Joyce Farrell,141.41,Cengage Learning,01/28/2014,704
1904,9780735671270,Microsoft Outlook 2013 Inside Out,Jim Boyce,34.67,Microsoft Press,07/25/2013,824
1905,9780321967053,More Agile Testing: Learning Journeys for the Whole Team (Addison-Wesley Signature Series (Cohn)),Janet Gregory,38.79,Addison-Wesley Professional,10/16/2014,544
1906,9780982760833,The PMI-ACP Exam: How To Pass On Your First Try (Test Prep series),Andy Crowe PMP  PgMP,39.75,Velociteach,02/15/2012,275
1907,9781111969608,"Database Systems: Design, Implementation, and Management (with Premium WebSite Printed Access Card and Essential Textbook Resources Printed Access Card)",Carlos Coronel,67,Cengage Learning,01/01/2012,752
1908,9780672329463,Linux Kernel Development (3rd Edition),Robert Love,37.86,Addison-Wesley Professional,07/02/2010,440
1909,9780131873216,"Speech and Language Processing, 2nd Edition",Daniel Jurafsky,133.53,Prentice Hall,05/16/2008,1024
1910,9781491947135,QuickBooks 2015: The Missing Manual: The Official Intuit Guide to QuickBooks 2015,Bonnie Biafore,24.91,O'Reilly Media,11/08/2014,802
1911,9780735648753,"MOS 2010 Study Guide for Microsoft Word, Excel, PowerPoint, and Outlook Exams (MOS Study Guide)",Joan Lambert,29.04,Microsoft Press,03/25/2011,736
1912,9781490532479,"Wordpress for Beginners: A Visual Step-by-Step Guide to Creating your Own Wordpress Site in Record Time, Starting from Zero!",Dr. Andy Williams,13.42,CreateSpace Independent Publishing Platform,06/25/2013,262
1913,9780470532188,Access 2010 All-in-One For Dummies,Alison Barrows,26.18,For Dummies,05/10/2010,792
1914,9780321637703,"Coaching Agile Teams: A Companion for ScrumMasters, Agile Coaches, and Project Managers in Transition (Addison-Wesley Signature Series (Cohn))",Lyssa Adkins,36.1,Addison-Wesley Professional,05/28/2010,352
1915,9780133142679,"Exploring Microsoft Office 2013, Volume 1 (Exploring for Office 2013)",Amy Rutledge,137.73,Prentice Hall,04/20/2013,1136
1916,9780735662681,CompTIA A+ Training Kit (Exam 220-801 and Exam 220-802) (Microsoft Press Training Kit),Darril Gibson,43.4,Microsoft Press,01/01/2013,1024
1917,9781118401668,eBay Business All-in-One For Dummies,Marsha Collier,26.3,For Dummies,08/05/2013,840
1918,9781118357040,"Information Technology for Management: Advancing Sustainable, Profitable Business Growth",Efraim Turban,170.56,Wiley,01/14/2013,480
1919,9780789750884,CCNA Routing and Switching 200-120 Network Simulator,Wendell Odom,124.94,Pearson IT Certification,12/29/2013,500
1920,9780956817204,"Agile Data Warehouse Design: Collaborative Dimensional Modeling, from Whiteboard to Star Schema",Lawrence Corr,26.9,DecisionOne Press,11/24/2011,328
1921,9780735684799,Exam Ref 70-411 Administering Windows Server 2012 R2 (MCSA),Charlie Russel,24.29,Microsoft Press,07/03/2014,432
1922,9781118751251,Adventures In Raspberry Pi,Carrie Anne Philbin,16.32,Wiley,01/07/2014,256
1923,9781449339739,Interactive Data Visualization for the Web,Scott Murray,23.58,O'Reilly Media,04/05/2013,272
1924,9780470531082,"Digital Design with RTL Design, VHDL, and Verilog",Frank Vahid,191.88,Wiley,03/09/2010,592
1925,9781585038893,Residential Design Using Autodesk Revit 2015,Daniel John Stine,47.73,SDC Publications,05/01/2014,515
1926,9780321908452,The Digital Print: Preparing Images in Lightroom and Photoshop for Printing,Jeff Schewe,31.14,Peachpit Press,August 2013,336
1927,9780744015492,Ultra Street Fighter IV Bible,BradyGames,19.48,BRADY GAMES,08/05/2014,608
1928,9780805098075,"Dragnet Nation: A Quest for Privacy, Security, and Freedom in a World of Relentless Surveillance",Julia Angwin,20.2,Times Books,02/25/2014,304
1929,9780137027415,Understanding Digital Signal Processing (3rd Edition),Richard G. Lyons,84.27,Prentice Hall,11/11/2010,984
1930,9780470497487,Office 2010 All-in-One For Dummies,Peter Weverka,20.91,For Dummies,05/10/2010,816
1931,9781118312476,Scrivener For Dummies,Gwen Hernandez,16.35,For Dummies,08/13/2012,402
1932,9781593273835,The Book of GIMP: A Complete Guide to Nearly Everything,Olivier Lecarme,31.33,No Starch Press,01/25/2013,676
1933,9780133953558,Pet Photography: From Snapshots to Great Shots,Alan Hess,17.75,Peachpit Press,10/03/2014,240
1934,9781587205620,CCNA Wireless 640-722 Official Cert Guide (Certification Guide),David Hucaby,30.37,Cisco Press,03/31/2014,544
1935,9781449341701,Dreamweaver CC: The Missing Manual,David Sawyer McFarland,36.05,O'Reilly Media,12/30/2013,1006
1936,9781937785659,Seven Concurrency Models in Seven Weeks: When Threads Unravel (The Pragmatic Programmers),Paul Butcher,31.82,Pragmatic Bookshelf,07/10/2014,300
1937,9780672324536,Data Structures and Algorithms in Java (2nd Edition),Robert Lafore,41.48,Sams Publishing,11/16/2002,800
1938,9789187445088,"System Center 2012 R2 Configuration Manager: Mastering the Fundamentals, 3rd Edition",Kent Agerlund,37.95,Deployment Artist,06/18/2014,652
1939,9780321902948,OpenGL SuperBible: Comprehensive Tutorial and Reference (6th Edition),Graham Sellers,43.16,Addison-Wesley Professional,07/31/2013,848
1940,9781890774783,"Murach's Java Servlets and JSP, 3rd Edition (Murach: Training & Reference)",Joel Murach,40.84,Mike Murach & Associates,06/09/2014,758
1941,9780596528126,Mastering Regular Expressions,Jeffrey E. F. Friedl,30.98,O'Reilly Media,08/15/2006,544
1942,9781589483569,GIS Tutorial for Python Scripting,David W. Allen,44.03,Esri Press,07/24/2014,265
1943,9781449387860,Network Warrior,Gary A. Donahue,29.56,O'Reilly Media,06/02/2011,788
1944,9780071633055,McGraw-Hill's PMP Certification Mathematics with CD-ROM,Vidya Subramanian,27.9,McGraw-Hill,02/25/2010,219
1945,9781118862155,Autodesk Revit Architecture 2015: No Experience Required: Autodesk Official Press,Eric Wing,37.77,Sybex,06/03/2014,1008
1946,9780789749741,CompTIA A+ 220-801 and 220-802 Authorized Practice Questions Exam Cram (5th Edition),David L. Prowse,18.22,Pearson IT Certification,08/03/2012,320
1947,9781587143045,NX-OS and Cisco Nexus Switching: Next-Generation Data Center Architectures (2nd Edition) (Networking Technology),Ron Fuller,50.66,Cisco Press,03/23/2013,864
1948,9781285168449,Microsoft Excel 2013: Complete (Shelly Cashman),Joy L. Starks,103.48,Cengage Learning,08/19/2013,592
1949,9781118772652,Kindle Fire HDX For Dummies,Nancy C. Muir,15.15,For Dummies,12/10/2013,288
1950,9780744015256,Borderlands 2 Game of the Year Edition Strategy Guide,Doug Walsh,23.12,BRADY GAMES,10/14/2013,608
1951,9781893939943,Wireshark Network Analysis (Second Edition): The Official Wireshark Certified Network Analyst Study Guide,Laura Chappell,92.2,Laura Chappell University,03/01/2012,986
1952,9780135090497,Technical Drawing with Engineering Graphics (14th Edition),Marla Goodman,120.43,Peachpit Press,01/07/2011,936
1953,9781118086834,Business Data Communications and Networking,Jerry FitzGerald,55.18,Wiley,08/23/2011,608
